first_sentence,second_sentence,score,dot_score,cos_score,eucl_score,score_type,score_name
"The cat was lying by the mouse hole waiting for the mouse, but it was too impatient.",The mouse was too impatient.,0,13.8966064453125,0.7868229746818542,2.9700937,binary,is_entailment
"Everyone really loved the oatmeal cookies; only a few people liked the chocolate chip cookies. Next time, we should make more of them.",We should make more of the chocolate chip cookies.,0,16.08161735534668,0.8862206935882568,2.2740128,binary,is_entailment
Jim signaled the barman and gestured toward his bathroom key.,Jim signaled the barman and gestured toward Jim's bathroom key.,0,7.3566789627075195,1.0000001192092896,0.0,binary,is_entailment
"Mark was close to Mr. Singer's heels. He heard him calling for the captain, promising him, in the jargon everyone talked that night, that not one thing should be damaged on the ship except only the ammunition, but the captain and all his crew had best stay in the cabin until the work was over.",He heard Mr. Singer calling for the captain.,1,6.939337253570557,0.7158821821212769,2.4789171,binary,is_entailment
I couldn't put the pot on the shelf because it was too tall.,The shelf was too tall.,0,19.088302612304688,0.8508226871490479,2.6762516,binary,is_entailment
John was jogging through the park when he saw a man juggling watermelons. He was very impressive.,The juggler was very impressive.,1,4.231973648071289,0.38552191853523254,3.803254,binary,is_entailment
"The lawyer asked the witness a question, but he was reluctant to answer it.",The witness was reluctant to answer it.,1,14.431015014648438,0.9084528684616089,1.7102762,binary,is_entailment
"Susan knew that Ann's son had been in a car accident, because she told her about it.",Susan told her about it.,0,13.959964752197266,0.7317504286766052,3.329889,binary,is_entailment
"Since Chester was dependent on Uncle Vernon, he couldn't very well marry without his approval",Chester couldn't very well marry without his approval,1,9.000672340393066,0.8076671361923218,2.2788186,binary,is_entailment
"When the sponsors of the bill got to the town hall, they were surprised to find that the room was full of opponents. They were very much in the majority.",The opponents were very much in the majority.,1,11.030370712280273,0.6606625318527222,3.7404523,binary,is_entailment
Billy cried because Toby wouldn't share his toy.,Billy cried because Toby wouldn't share Toby's toy.,1,10.461236000061035,1.0,0.0,binary,is_entailment
At the Loebner competition the judges couldn't figure out which respondents were the chatbots because they were so stupid.,The judges were so stupid.,1,10.94983959197998,0.7106403708457947,3.3898048,binary,is_entailment
The large ball crashed right through the table because it was made of steel.,The table was made of steel.,0,14.612110137939453,0.7277921438217163,3.582008,binary,is_entailment
"Grant worked hard to harvest his beans so he and his family would have enough to eat that winter, His friend Henry let him stack them in his barn where they would dry. Later, he and Tatyana would shell them and cook them for their Sunday dinners.",His friend Henry let him stack the beans in his barn where they would dry.,1,7.424890518188477,0.8518955707550049,1.6714646,binary,is_entailment
"Jane knocked on Susan's door, but there was no answer. She was out.",Jane was out.,0,11.118532180786133,0.49758002161979675,5.428322,binary,is_entailment
"Jane knocked on the door, and Susan answered it. She invited her to come in.",Jane invited her to come in.,0,5.5494208335876465,0.7553553581237793,1.8999006,binary,is_entailment
The table won't fit through the doorway because it is too wide.,The doorway is too wide.,0,14.105981826782227,0.8022420406341553,2.7880535,binary,is_entailment
"A number of times Henry had been present at interviews which his father had had with noted detectives who desired his aid in solving perplexing mysteries, and those occasions stood out as red-letter days for him.",Those occasions stood out as red-letter days for father.,0,7.419580459594727,0.7527930736541748,2.45106,binary,is_entailment
"If the con artist has succeeded in fooling Sam, he would have lost a lot of money.",Sam would have lost a lot of money.,1,11.17275619506836,0.8694388270378113,2.0671668,binary,is_entailment
"Larry, a timid teen-ager, lives with his widowed mother in a Brooklyn housing project. Larry's father, a gang leader, was shot to death; his father's disciple, Antonio, takes Larry under his wing, and quickly molds him into a drug runner.","His father's disciple, Antonio, takes Larry under his wing, and quickly molds Larry's father into a drug runner.",0,6.2129645347595215,0.8766955137252808,1.324142,binary,is_entailment
Frank felt crushed when his longtime rival Bill revealed that he was the winner of the competition.,Frank was the winner of the competition.,0,12.205728530883789,0.8063153028488159,2.7521105,binary,is_entailment
"Fred covered his eyes with his hands, because the wind was blowing sand around. He lowered them when the wind stopped.",He lowered his hands when the wind stopped.,1,11.347770690917969,0.8775843977928162,1.8118548,binary,is_entailment
The Wainwrights treated Mr. Crowley like a prince until he made his will in their favor; then they treated him like dirt. Folks said he died just to be rid of their everlasting nagging.,Folks said he died just to be ride of the folks' everlasting nagging.,0,5.573171615600586,0.7682878971099854,1.9286684,binary,is_entailment
The father carried the sleeping boy in his arms.,The father carried the sleeping boy in the boy's arms.,0,15.670645713806152,1.0,0.0,binary,is_entailment
There is a gap in the wall. You can see the garden through it.,You can see the garden through the wall.,0,19.320262908935547,0.8769394755363464,2.4808116,binary,is_entailment
"Archaeologists have concluded that humans lived in Laputa 20,000 years ago. They hunted for deer on the river banks.",Archaeologists hunted for deer on the river banks.,0,9.847101211547852,0.8230443000793457,2.385168,binary,is_entailment
"Susan knew that Ann's son had been in a car accident, so she told her about it.",Susan told her about it.,1,13.959964752197266,0.7317504286766052,3.329889,binary,is_entailment
"Then Dad figured out how much the man owed the store; to that he added the man's board-bill at the cook-shanty. He subtracted that amount from the man's wages, and made out his check",The man subtracted that amount from the man's wages.,0,8.936971664428711,0.7614637613296509,2.5941765,binary,is_entailment
The customer walked into the bank and stabbed one of the tellers. He was immediately taken to the hospital.,The teller was immediately taken to the hospital.,1,10.865255355834961,0.8325108289718628,2.1274288,binary,is_entailment
Kirilov ceded the presidency to Shatov because he was less popular.,Kirilov was less popular.,1,8.359477996826172,0.6068423390388489,3.3702135,binary,is_entailment
John hired Bill to take care of him.,John hired Bill to take care of Bill.,0,19.434465408325195,0.9999998807907104,0.0,binary,is_entailment
Bill passed the gameboy to John because his turn was next.,John's turn was next.,1,8.877473831176758,0.5738158226013184,3.9001627,binary,is_entailment
Joe paid the detective after he delivered the final report on the case.,Joe delivered the final report on the case.,0,12.276954650878906,0.936830997467041,1.3258896,binary,is_entailment
"Fred is the only man alive who still remembers my father as an infant. When Fred first saw my father, he was twelve months old.","When Fred first saw my father, My father was twelve months old.",1,13.560348510742188,0.9553428292274475,1.2209072,binary,is_entailment
James asked Robert for a favor but he was refused.,James was refused.,1,15.44413948059082,0.8893083333969116,2.0837595,binary,is_entailment
"Lily spoke to Donna, breaking her silence.","Lily spoke to Donna, breaking Lily's silence.",1,9.916404724121094,1.0000001192092896,0.0,binary,is_entailment
"Bob was playing cards with Adam and was way ahead. If Adam hadn't had a sudden run of good luck, he would have lost.",Bob would have lost.,0,10.684243202209473,0.6811988353729248,3.4779632,binary,is_entailment
Dan had to stop Bill from toying with the injured bird. He is very cruel.,Dan is very cruel.,0,10.254148483276367,0.6624681949615479,3.7173028,binary,is_entailment
"Ann asked Mary what time the library closes, but she had forgotten.",Mary had forgotten.,1,10.188236236572266,0.7197188138961792,3.0942454,binary,is_entailment
The sculpture rolled off the shelf because it wasn't anchored.,The sculpture wasn't anchored.,1,12.362375259399414,0.7774922847747803,2.8561099,binary,is_entailment
Carol believed that Rebecca suspected that she had stolen the watch.,Carol believed that Rebecca suspected that Carol had stolen the watch.,1,10.268956184387207,0.9726642370223999,0.75974125,binary,is_entailment
"Paul tried to call George on the phone, but he wasn't successful.",George wasn't successful.,0,13.760964393615723,0.7890915274620056,2.8609214,binary,is_entailment
"Mary tucked her daughter Anne into bed, so that she could work.","Mary tucked her daughter Anne into bed, so that Mary could work.",1,14.844154357910156,0.9865524172782898,0.6635344,binary,is_entailment
James asked Robert for a favor but he refused.,Robert refused.,1,15.717456817626953,0.8811590075492859,2.2193527,binary,is_entailment
"I couldn't find a spoon, so I tried using a pen to stir my coffee. But that turned out to be a bad idea, because it got full of coffee.",The coffee got full of coffee.,0,13.585814476013184,0.7528207898139954,3.60794,binary,is_entailment
"The path to the lake was blocked, so we couldn't use it.",We couldn't use the path.,1,15.526082038879395,0.7980684041976929,2.9165914,binary,is_entailment
"Stretching her back, the woman smiled at the girl.","Stretching the girl's back, the woman smiled at the girl.",0,16.05266761779785,1.0,0.0,binary,is_entailment
"Archaeologists have concluded that humans lived in Laputa 20,000 years ago. They hunted for evidence on the river banks.",Archaeologists hunted for evidence on the river banks.,1,9.888853073120117,0.8422301411628723,2.1893415,binary,is_entailment
"I tried to paint a picture of an orchard, with lemons in the lemon trees, but they came out looking more like light bulbs.",The lemons came out looking more like light bulbs.,1,9.529930114746094,0.8893030881881714,1.5709968,binary,is_entailment
"This morning, Joey built a sand castle on the beach, and put a toy flag in the highest tower, but this afternoon the tide knocked it down.",This afternoon the tide knocked The sand castle down.,1,9.483424186706543,0.85174959897995,1.9321526,binary,is_entailment
The foxes are getting in at night and attacking the chickens. They have gotten very nervous.,The chickens have gotten very nervous.,1,12.032142639160156,0.8316738605499268,2.37352,binary,is_entailment
Tom threw his schoolbag down to Ray after he reached the top of the stairs.,Ray reached the top of the stairs.,0,9.467933654785156,0.8059662580490112,2.3791366,binary,is_entailment
"In July, Kamtchatka declared war on Yakutsk. Since Yakutsk's army was much better equipped and ten times larger, they were defeated within weeks.",Kamchatka was defeated within weeks.,1,6.743226528167725,0.5785013437271118,3.195059,binary,is_entailment
Madonna fired her trainer because she slept with her boyfriend.,The trainer slept with her boyfriend.,1,13.344268798828125,0.8795549869537354,2.0392988,binary,is_entailment
Dan had to stop Bill from toying with the injured bird. He is very compassionate.,Dan is very compassionate.,1,8.177350997924805,0.5902330279350281,3.8121514,binary,is_entailment
"I used an old rag to clean the knife, and then I put it in the trash.",I put the rag in the trash.,1,12.736309051513672,0.6922179460525513,3.5750299,binary,is_entailment
"Patting her back, the woman smiled at the girl.","Patting the woman's back, the woman smiled at the girl.",0,17.763221740722656,1.0,0.0,binary,is_entailment
The large ball crashed right through the table because it was made of styrofoam.,The table was made of styrofoam.,1,10.736425399780273,0.6309000253677368,3.7468688,binary,is_entailment
"I was trying to open the lock with the key, but someone had filled the keyhole with chewing gum, and I couldn't get it out.",I couldn't get the chewing gum out.,1,10.937070846557617,0.5835975408554077,4.9367127,binary,is_entailment
"Adam can't leave work here until Bob arrives to replace him. If Bob had left home for work on time, he would be gone by this time.",Adam would be gone by this time.,1,10.996480941772461,0.8390985131263733,2.0876377,binary,is_entailment
"Bob paid for Charlie's college education, but now Charlie acts as though it never happened. He is very hurt.",Bob is very hurt.,1,10.641897201538086,0.6942234039306641,3.3215592,binary,is_entailment
"Bernard, who had not told the government official that he was less than 21 when he filed for a homestead claim, did not consider that he had done anything dishonest. Still, anyone who knew that he was 19 years old could take his claim away from him.",Anyone who knew that he was 19 years old could take his claim away from Bernard.,1,9.67561149597168,0.8991699814796448,1.5360873,binary,is_entailment
Mary took out her flute and played one of her favorite pieces. She has had it since she was a child.,She has had the flute since she was a child.,1,13.211387634277344,0.7510944604873657,3.2923691,binary,is_entailment
"Sam and Amy are passionately in love, but Amy's parents are unhappy about it, because they are snobs.",Sam and Amy are snobs.,0,8.024418830871582,0.7056350111961365,2.6426582,binary,is_entailment
This book introduced Shakespeare to Goethe; it was a fine selection of his writing.,It was a fine selection of Shakespeare's writing.,1,12.166248321533203,0.7944000363349915,2.6088514,binary,is_entailment
The foxes are getting in at night and attacking the chickens. I shall have to guard them.,I shall have to guard The chickens.,1,10.664440155029297,0.7915887832641602,2.541248,binary,is_entailment
"The donkey wished a wart on its hind leg would disappear, and it did.","The donkey wished a wart on its hind leg would disappear, and wart did.",1,9.178160667419434,0.9658386707305908,0.81151086,binary,is_entailment
I put the cake away in the refrigerator. It has a lot of butter in it.,The refrigerator has a lot of butter in it.,0,18.33025360107422,0.9270691871643066,1.7611395,binary,is_entailment
"The sack of potatoes had been placed below the bag of flour, so it had to be moved first.",The sack of potatoes had to be moved first.,0,12.878838539123535,0.8614050149917603,2.04926,binary,is_entailment
"Papa looked down at the children's faces, so puzzled and sad now. It was bad enough that they had to be denied so many things because he couldn't afford them.",He couldn't afford the faces.,0,9.09819221496582,0.6562900543212891,3.3562548,binary,is_entailment
I put the heavy book on the table and it broke.,The heavy book broke.,0,14.805938720703125,0.9239256381988525,1.5781596,binary,is_entailment
"I used an old rag to clean the knife, and then I put it in the drawer.",I put the knife in the drawer.,1,15.394861221313477,0.72193843126297,4.062565,binary,is_entailment
James asked Robert for a favor but he refused.,James refused.,0,15.44413948059082,0.8893083333969116,2.0837595,binary,is_entailment
Men had the right to keep their sons working for them until they were 21 years of age.,Men had the right to keep their sons working for them until the sons were 21 years of age.,1,14.963537216186523,0.9865381717681885,0.63980913,binary,is_entailment
"The older students were bullying the younger ones, so we rescued them.",We rescued the younger students.,1,14.694493293762207,0.8933599591255188,1.9821221,binary,is_entailment
"This morning, Joey built a sand castle on the beach, and put a toy flag in the highest tower, but this afternoon the wind knocked it down.",This afternoon the wind knocked The flag down.,1,10.157560348510742,0.7943021655082703,2.492521,binary,is_entailment
"The sack of potatoes had been placed above the bag of flour, so it had to be moved first.",The sack of potatoes had to be moved first.,1,12.878838539123535,0.8614050149917603,2.04926,binary,is_entailment
Anne gave birth to a daughter last month. She is a very charming baby.,Anne's daughter is a very charming baby.,1,14.481451034545898,0.8687196373939514,2.2890682,binary,is_entailment
"Tatyana managed two guitars and a bag, and still could point out the Freemans: ""Isn't it nice that they have come, Mama!""","Isn't it nice that the Freemans have come, Mama!""",1,6.854284286499023,0.7962994575500488,2.0590758,binary,is_entailment
The painting in Mark's living room shows an oak tree. It is to the right of the bookcase.,The painting is to the right of the bookcase.,1,9.892338752746582,0.7345244884490967,2.7081654,binary,is_entailment
"Mark was close to Mr. Singer's heels. He heard him calling for the captain, promising him, in the jargon everyone talked that night, that not one thing should be damaged on the ship except only the ammunition, but the captain and all his crew had best stay in the cabin until the work was over.",The captain and all Mark's crew had best stay in the cabin until the work was over.,0,9.049301147460938,0.8657852411270142,1.9902855,binary,is_entailment
"When Tatyana reached the cabin, her mother was sleeping. She was careful not to disturb her, undressing and climbing back into her berth.","She was careful not to disturb her, undressing and climbing back into her mother's berth.",0,6.1345672607421875,0.7682536840438843,1.9689622,binary,is_entailment
Mark heard Steve's feet going down the ladder. The door of the shop closed after him. He ran to look out the window.,Steve ran to look out the window.,0,10.434514999389648,0.8119115829467773,2.2195082,binary,is_entailment
The storekeepers stayed in town to run their stores and lived in the rooms behind them.,The storekeepers stayed in town to run their stores and lived in the rooms behind the storekeepers.,0,10.546499252319336,0.9776231050491333,0.7200647,binary,is_entailment
Pete envies Martin because he is very successful.,Pete is very successful.,0,11.296954154968262,0.7824949026107788,2.8543553,binary,is_entailment
"Always before, Larry had helped Dad with his work. But he could not help him now, for Dad said that his boss at the railroad company would not want anyone but him to work in the office.",Dad's boss at the railroad company would not want anyone but him to work in the office.,1,12.162951469421387,0.9043492674827576,1.6519237,binary,is_entailment
"Grant worked hard to harvest his beans so he and his family would have enough to eat that winter, His friend Henry let him stack them in his barn where they would dry. Later, he and Tatyana would shell them and cook them for their Sunday dinners.","Later, he and Tatyana would shell them and cook them for his and Tatyana's Sunday dinners.",1,6.264914512634277,0.7577350735664368,2.0233727,binary,is_entailment
"The journalists interviewed the stars of the new movie. They were very persistent, so the interview lasted for a long time.","The stars were very persistent, so the interview lasted for a long time.",0,10.850068092346191,0.92438805103302,1.3500098,binary,is_entailment
Anna did a lot worse than her good friend Lucy on the test because she had studied so hard.,Anna had studied so hard.,0,10.368983268737793,0.7753779888153076,2.558933,binary,is_entailment
Dr. Adams informed Kate that she had cancer and presented several options for future treatment.,Kate had cancer and presented several options for future treatment.,1,10.43787956237793,0.927836537361145,1.3602828,binary,is_entailment
This book introduced Shakespeare to Ovid; it was a fine selection of his writing.,It was a fine selection of Ovid's writing.,1,11.762210845947266,0.7927421927452087,2.6134753,binary,is_entailment
"During a game of tag, Ethan ran from Luke because he was ""it"".","Luke was ""it"".",1,12.157796859741211,0.5612958669662476,5.266282,binary,is_entailment
"Mr. Moncrieff visited Chester's luxurious New York apartment, thinking that it belonged to his son Edward. The result was that Mr. Moncrieff has decided to cancel Edward's allowance on the ground that he no longer requires his financial support.",Mr. Moncrieff no longer requires his financial support.,0,5.891968727111816,0.7729892730712891,1.9964545,binary,is_entailment
"Alice tried frantically to stop her daughter from chatting at the party, leaving us to wonder why she was behaving so strangely.",Alice was behaving so strangely.,1,6.896724700927734,0.6003074645996094,3.2324631,binary,is_entailment
"The signs over the shops' doors had pictures that indicated what work was done inside. Although more and more people were learning how to read, each artisan still had signs, not wishing to lose a possible patron merely because he happened to be illiterate.","Each artisan still had signs, not wishing to lose a possible patron merely because the patron happened to be illiterate.",1,5.881777763366699,0.8414126038551331,1.5085092,binary,is_entailment
The scientists are studying three species of fish that have recently been found living in the Indian Ocean. They began two years ago.,The fish began two years ago.,0,13.578109741210938,0.8678820729255676,2.079433,binary,is_entailment
"Dan took the rear seat while Bill claimed the front because his ""Dibs!"" was quicker.","Dan took the rear seat while Bill claimed the front because Bill's ""Dibs!"" was quicker.",1,9.128418922424316,1.0,0.0,binary,is_entailment
Sam Goodman's biography of the Spartan general Xenophanes conveys a vivid sense of the difficulties he faced in his research.,Sam Goodman's biography of the Spartan general Xenophanes conveys a vivid sense of the difficulties Xenophanes faced in his research.,0,4.897291660308838,0.9769582748413086,0.5086927,binary,is_entailment
"I stuck a pin through a carrot. When I pulled the pin out, it left a hole.",The pin left a hole.,1,15.995368957519531,0.9094261527061462,1.9803398,binary,is_entailment
"Jackson was greatly influenced by Arnold, though he lived two centuries later.",Arnold lived two centuries later.,0,11.045267105102539,0.8748432397842407,1.8346204,binary,is_entailment
The politicians far away in Washington could not know the settlers so they must make rules to regulate them.,They must make rules to regular the settlers.,1,12.005559921264648,0.8176130056381226,2.3637464,binary,is_entailment
"As Andrea in the crop duster passed over Susan, she could see the landing gear.",Andrea could see the landing gear.,0,8.290838241577148,0.7090518474578857,2.9284062,binary,is_entailment
Mama came over and sat down beside Alice. Gently she stroked her hair and let the child weep.,She stroked Alice's hair and let the child weep.,1,9.792510032653809,0.8937016129493713,1.6221437,binary,is_entailment
Joe has sold his house and bought a new one a few miles away. He will be moving out of it on Thursday.,He will be moving out of The new house on Thursday.,0,13.679052352905273,0.8598536252975464,2.234792,binary,is_entailment
Mama came over and sat down beside Alice. Gently she stroked her hair and let the child weep.,She stroked Mama's hair and let the child weep.,0,9.792510032653809,0.8937016129493713,1.6221437,binary,is_entailment
Joan made sure to thank Susan for all the help she had recieved.,Joan made sure to thank Susan for all the help Joan had recieved.,1,9.139350891113281,0.9710953235626221,0.7473437,binary,is_entailment
"I sat there feeling rather like a chappie I'd once read about in a book, who murdered another cove and hid the body under the dining-room table, and then had to be the life and soul of a dinner party, with it there all the time.","He had to be the life and soul of a dinner party, with the table there all the time.",0,8.880866050720215,0.8632004261016846,2.1563554,binary,is_entailment
"Larry, a timid teen-ager, lives with his widowed mother in a Brooklyn housing project. Larry's father, a gang leader, was shot to death; his father's disciple, Antonio, takes Larry under his wing, and quickly molds him into a drug runner.","His father's disciple, Antonio, takes Larry under his wing, and quickly molds Antonio into a drug runner.",1,5.773571968078613,0.7924129962921143,1.7458186,binary,is_entailment
"The older students were bullying the younger ones, so we punished them.",We punished the older students.,1,15.195367813110352,0.9264975786209106,1.6209733,binary,is_entailment
At the Loebner competition the judges couldn't figure out which respondents were the chatbots because they were so advanced.,The chatbots were so advanced.,1,8.4246826171875,0.4227014183998108,5.6947083,binary,is_entailment
"Pam's parents came home and found her having sex with her boyfriend, Paul. They were embarrassed about it.",Pam and Paul were embarrassed about it.,1,8.223033905029297,0.6151532530784607,3.2121305,binary,is_entailment
"During a game of tag, Ethan ran from Luke because he was ""it"".","Ethan was ""it"".",0,9.172534942626953,0.4385668933391571,5.5648847,binary,is_entailment
"I was trying to open the lock with the key, but someone had filled the keyhole with chewing gum, and I couldn't get it out.",I couldn't get the key out.,0,8.935864448547363,0.48475080728530884,5.2137036,binary,is_entailment
"Alice looked for her friend Jade in the crowd. Since she always has good luck, Alice spotted her quickly.","Since Alice always has good luck, Alice spotted her quickly.",1,9.767600059509277,0.919863224029541,1.3372548,binary,is_entailment
"Since it was raining, I carried the newspaper over my backpack to keep it dry.",I carried the newspaper over my backpack to keep the newspaper dry.,0,12.928547859191895,0.8776671290397644,1.9990991,binary,is_entailment
