first_sentence,second_sentence,score,dot_score,cos_score,eucl_score,score_type,score_name
"I stuck a pin through a carrot. When I pulled the pin out, it had a hole.",The carrot had a hole.,1,14.614618301391602,0.7284960150718689,3.4542332,binary,is_entailment
John couldn't see the stage with Billy in front of him because he is so short.,John is so short.,1,16.455963134765625,0.8436453342437744,2.6074104,binary,is_entailment
The police arrested all of the gang members. They were trying to stop the drug trade in the neighborhood.,The police were trying to stop the drug trade in the neighborhood.,1,16.864646911621094,0.9480737447738647,1.3672366,binary,is_entailment
Steve follows Fred's example in everything. He influences him hugely.,Steve influences him hugely.,0,9.931831359863281,0.85578453540802,1.9746352,binary,is_entailment
"When Tatyana reached the cabin, her mother was sleeping. She was careful not to disturb her, undressing and climbing back into her berth.","mother was careful not to disturb her, undressing and climbing back into her berth.",0,6.329538345336914,0.8663139939308167,1.4068686,binary,is_entailment
"George got free tickets to the play, but he gave them to Eric, because he was particularly eager to see it.",George was particularly eager to see it.,0,9.706558227539062,0.7297831773757935,2.7308838,binary,is_entailment
John was jogging through the park when he saw a man juggling watermelons. He was very impressive.,John was very impressive.,0,8.40182113647461,0.6350817084312439,3.5788145,binary,is_entailment
I couldn't put the pot on the shelf because it was too tall.,The pot was too tall.,1,20.831459045410156,0.8760007619857788,2.6224535,binary,is_entailment
"We had hoped to place copies of our newsletter on all the chairs in the auditorium, but there were simply not enough of them.",There were simply not enough copies of the newsletter.,1,8.544527053833008,0.7239440679550171,2.7745562,binary,is_entailment
At the Loebner competition the judges couldn't figure out which respondents were the chatbots because they were so advanced.,The judges were so advanced.,0,10.445457458496094,0.7130754590034485,3.2244666,binary,is_entailment
I took the water bottle out of the backpack so that it would be lighter.,I took the water bottle out of the backpack so that the backpack would be lighter.,1,15.270463943481445,0.9778207540512085,0.8325796,binary,is_entailment
The table won't fit through the doorway because it is too narrow.,The table is too narrow.,0,16.524433135986328,0.8758151531219482,2.4115846,binary,is_entailment
I took the water bottle out of the backpack so that it would be handy.,I took the water bottle out of the backpack so that the backpack would be handy.,0,14.121503829956055,0.9776164293289185,0.8080064,binary,is_entailment
The firemen arrived after the police because they were coming from so far away.,The police were coming from so far away.,0,15.196004867553711,0.9257349967956543,1.6361631,binary,is_entailment
"Always before, Larry had helped Dad with his work. But he could not help him now, for Dad said that his boss at the railroad company would not want anyone but him to work in the office.",Dad could not help him now.,0,12.536588668823242,0.7800861597061157,2.8963943,binary,is_entailment
I poured water from the bottle into the cup until it was empty.,The cup was empty.,0,27.481590270996094,0.6652280688285828,6.3809648,binary,is_entailment
I put the cake away in the refrigerator. It has a lot of butter in it.,The cake has a lot of butter in it.,1,19.342927932739258,0.919450044631958,1.9940898,binary,is_entailment
"Lionel is holding captive a scientist, Dr. Vardi, who has invented a device that turns animals invisible; Lionel plans to use it on Geoffrey and send him to steal nuclear material from an army vault.",Lionel plans to use it on Geoffrey and send Lionel to steal nuclear material from an army vault.,0,6.177116870880127,0.8753632307052612,1.4484221,binary,is_entailment
The foxes are getting in at night and attacking the chickens. They have gotten very bold.,The foxes have gotten very bold.,1,9.575101852416992,0.7973638772964478,2.256579,binary,is_entailment
"Sam pulled up a chair to the piano, but it was broken, so he had to stand instead.","The piano was broken, so he had to stand instead.",0,10.893959045410156,0.8896291255950928,1.7154989,binary,is_entailment
Jane knocked on Susan's door but she did not get an answer.,Susan did not get an answer.,0,9.230716705322266,0.5947179198265076,3.6242921,binary,is_entailment
"Bob was playing cards with Adam and was way ahead. If Adam hadn't had a sudden run of good luck, he would have won.",Adam would have won.,0,10.875377655029297,0.5303411483764648,5.2266965,binary,is_entailment
I put the butterfly wing on the table and it broke.,The table broke.,0,14.191547393798828,0.736427903175354,3.2664752,binary,is_entailment
"Paul tried to call George on the phone, but he wasn't successful.",Paul wasn't successful.,1,13.445409774780273,0.7752761244773865,2.9287071,binary,is_entailment
Look! There is a shark swimming right below that duck! It had better get away to safety fast!,The shark had better get away to safety fast!,0,12.974108695983887,0.9192543029785156,1.5542723,binary,is_entailment
The trophy doesn't fit into the brown suitcase because it is too large.,The suitcase is too large.,0,12.34867000579834,0.7286041378974915,3.241481,binary,is_entailment
"Joe's uncle can still beat him at tennis, even though he is 30 years older.",Joe is 30 years older.,0,12.217206954956055,0.8173452019691467,2.3540351,binary,is_entailment
The large ball crashed right through the table because it was made of steel.,The large ball was made of steel.,1,15.58724594116211,0.8703919649124146,2.3033078,binary,is_entailment
Sam broke both his ankles and he's walking with crutches. But a month or so from now they should be better.,The crutches should be better.,0,10.599081039428711,0.7449475526809692,2.9991004,binary,is_entailment
"Grant worked hard to harvest his beans so he and his family would have enough to eat that winter, His friend Henry let him stack them in his barn where they would dry. Later, he and Tatyana would shell them and cook them for their Sunday dinners.",His friend Henry let him stack Grant and his family in his barn where they would dry.,0,7.249881744384766,0.8441593050956726,1.6876376,binary,is_entailment
"Jane knocked on the door, and Susan answered it. She invited her to come out.",Jane invited her to come out.,1,9.467472076416016,0.7979341149330139,2.2722917,binary,is_entailment
Dan had to stop Bill from toying with the injured bird. He is very cruel.,Bill is very cruel.,1,11.3792085647583,0.5208758115768433,5.995838,binary,is_entailment
"Tom said ""Check"" to Ralph as he took his bishop.","Tom said ""Check"" to Ralph as he took Ralph's bishop.",1,12.060126304626465,1.0000001192092896,0.0,binary,is_entailment
"I sallied out for a bit of food, more to pass the time than because I wanted it.","I sallied out for a bit of food, more to pass the time than because I wanted food.",1,10.504993438720703,0.9718737006187439,0.81508034,binary,is_entailment
Joe paid the detective after he received the final report on the case.,Joe received the final report on the case.,1,12.877066612243652,0.9420304298400879,1.2959296,binary,is_entailment
"We had hoped to place copies of our newsletter on all the chairs in the auditorium, but there were simply too many of them.",There were simply too many copies of the newsletter.,0,8.544527053833008,0.7239440679550171,2.7745562,binary,is_entailment
Joe has sold his house and bought a new one a few miles away. He will be moving into it on Thursday.,He will be moving into The new house on Thursday.,1,13.679052352905273,0.8598536252975464,2.234792,binary,is_entailment
"Always before, Larry had helped Dad with his work. But he could not help him now, for Dad said that his boss at the railroad company would not want anyone but him to work in the office.",He could not help Dad now.,1,12.536588668823242,0.7800861597061157,2.8963943,binary,is_entailment
"The table was piled high with food, and on the floor beside it there were crocks, baskets, and a five-quart pail of milk.","Beside the table there were crocks, baskets, and a five-quart pail of milk.",1,10.436614036560059,0.8585370182991028,1.8959955,binary,is_entailment
Jim comforted Kevin because he was so upset.,Kevin was so upset.,1,14.755268096923828,0.8480263948440552,2.5172997,binary,is_entailment
"Jackson was greatly influenced by Arnold, though he lived two centuries earlier.",Arnold lived two centuries earlier.,1,10.656661987304688,0.8682950735092163,1.853181,binary,is_entailment
"There is a pillar between me and the stage, and I can't see around it.",I can't see around the stage.,0,20.769201278686523,0.7551892399787903,4.0410085,binary,is_entailment
"Archaeologists have concluded that humans lived in Laputa 20,000 years ago. They hunted for deer on the river banks.",Prehistoric humans hunted for deer on the river banks.,1,10.185687065124512,0.8406148552894592,2.3338156,binary,is_entailment
"Sam and Amy are passionately in love, but Amy's parents are unhappy about it, because they are snobs.",Amy's parents are snobs.,1,9.141826629638672,0.6542679071426392,3.3977835,binary,is_entailment
Bill passed the half-empty plate to John because he was hungry.,John was hungry.,1,9.396806716918945,0.6906942129135132,3.4358,binary,is_entailment
Sara borrowed the book from the library because she needs it for an article she is working on. She writes it when she gets home from work.,She writes the book when she gets home from work.,0,11.7887601852417,0.926966667175293,1.5392463,binary,is_entailment
"John promised Bill to leave, so an hour later he left.",Bill left.,0,15.181463241577148,0.7192673683166504,3.948981,binary,is_entailment
Sara borrowed the book from the library because she needs it for an article she is working on. She reads it when she gets home from work.,She reads the article when she gets home from work.,0,10.482965469360352,0.9101597666740417,1.5081036,binary,is_entailment
Mark heard Steve's feet going down the ladder. The door of the shop closed after him. He ran to look out the window.,The door of the shop closed after Steve.,1,11.14900016784668,0.7993201613426208,2.4463851,binary,is_entailment
"Fred is the only man alive who still remembers my father as an infant. When Fred first saw my father, he was twelve years old.","When Fred first saw my father, My father was twelve years old.",0,14.223531723022461,0.957108199596405,1.245728,binary,is_entailment
"Tatyana knew that Grandma always enjoyed serving an abundance of food to her guests. Now Tatyana watched as Grandma gathered Tatyana's small mother into a wide, scrawny embrace and then propelled her to the table, lifting her shawl from her shoulders, seating her in the place of honor, and saying simply: ""There's plenty.""","Grandma gathered Tatyana's small mother into a wide, scrawny embrace and then propelled Grandma to the table.",0,5.277687072753906,0.8477972745895386,1.4151678,binary,is_entailment
Fred watched TV while George went out to buy groceries. After an hour he got back.,George got back.,1,11.469010353088379,0.7280105352401733,3.193286,binary,is_entailment
"Lily spoke to Donna, breaking her concentration.","Lily spoke to Donna, breaking Donna's concentration.",1,8.129955291748047,1.0,0.0,binary,is_entailment
"Although they ran at about the same speed, Sue beat Sally because she had such a bad start.",Sue had such a bad start.,0,10.332206726074219,0.7969707250595093,2.404182,binary,is_entailment
Madonna fired her trainer because she couldn't stand her boyfriend.,She couldn't stand Madonna's boyfriend.,0,11.193394660949707,0.7617819309234619,2.7708795,binary,is_entailment
I can't cut that tree down with that axe; it is too small.,The axe is too small.,1,14.89548110961914,0.8296326398849487,2.4873593,binary,is_entailment
Madonna fired her trainer because she slept with her boyfriend.,She slept with Madonna's boyfriend.,1,13.042613983154297,0.7726343870162964,3.0155609,binary,is_entailment
"I saw Jim yelling at some guy in a military uniform with a huge red beard. I don't know why he was, but he looked very unhappy.","I don't know why the guy in uniform was, but he looked very unhappy.",0,10.37682819366455,0.8737849593162537,1.8318192,binary,is_entailment
"Alice tried frantically to stop her daughter from chatting at the party, leaving us to wonder why she was behaving so strangely.",Alice's daughter was behaving so strangely.,0,8.242156982421875,0.7012056112289429,2.916445,binary,is_entailment
Jane knocked on Susan's door but she did not answer.,Jane did not answer.,0,11.664409637451172,0.736912190914154,3.003076,binary,is_entailment
The politicians far away in Washington could not know the settlers so they must make rules to regulate them.,The politicians must make rules to regulate them.,1,13.282431602478027,0.8607221841812134,2.1846502,binary,is_entailment
"A number of times Henry had been present at interviews which his father had had with noted detectives who desired his aid in solving perplexing mysteries, and those occasions stood out as red-letter days for him.",Those occasions stood out as red-letter days for Henry.,1,6.946961402893066,0.730310320854187,2.4507377,binary,is_entailment
"Sam pulled up a chair to the piano, but it was broken, so he had to stand instead.","The chair was broken, so he had to stand instead.",1,10.723982810974121,0.8802273869514465,1.7719831,binary,is_entailment
"Since it was raining, I carried the newspaper over my backpack to keep it dry.",I carried the newspaper over my backpack to keep the backpack dry.,1,12.451251983642578,0.9019709825515747,1.6850513,binary,is_entailment
The politicians far away in Washington could not know the settlers so they must make rules to regulate them.,They must make rules to regular the politicians.,0,12.365886688232422,0.8378183245658875,2.244838,binary,is_entailment
Anna did a lot better than her good friend Lucy on the test because she had studied so hard.,Anna had studied so hard.,1,10.824838638305664,0.7747758626937866,2.5764556,binary,is_entailment
"Mark was close to Mr. Singer's heels. He heard him calling for the captain, promising him, in the jargon everyone talked that night, that not one thing should be damaged on the ship except only the ammunition, but the captain and all his crew had best stay in the cabin until the work was over.",Mr. Singer heard him calling for the captain,0,6.939336776733398,0.7158821821212769,2.4789171,binary,is_entailment
Fred is the only man still alive who remembers my great-grandfather. He was a remarkable man.,My great-grandfather was a remarkable man.,1,9.448328971862793,0.8362761735916138,1.9505302,binary,is_entailment
I couldn't put the pot on the shelf because it was too high.,The shelf was too high.,1,17.03441619873047,0.8370047807693481,2.6380541,binary,is_entailment
No one joins Facebook to be sad and lonely. But a new study from the University of Wisconsin psychologist George Lincoln argues that that's exactly how it makes us feel.,That's exactly how the study makes us feel.,0,8.616161346435547,0.7779339551925659,2.478338,binary,is_entailment
Bob paid for Charlie's college education. He is very generous.,Bob is very generous.,1,13.915802001953125,0.7234864234924316,3.3202171,binary,is_entailment
"John promised Bill to leave, so an hour later he left.",John left.,1,15.07347297668457,0.8047167658805847,2.9999352,binary,is_entailment
Frank was upset with Tom because the toaster he had sold him didn't work.,The toaster Frank had sold him didn't work.,0,8.913536071777344,0.8621342182159424,1.7232112,binary,is_entailment
"Equally swoon-worthy is C.K. Dexter Haven, a pallid young dandy holding a jade-handled walking stick, with a poodle asleep at his feet.","Equally swoon-worthy is C.K. Dexter Haven, a pallid young dandy holding a jade-handled walking stick, with a poodle asleep at Haven's feet.",1,7.074215412139893,1.0,0.0,binary,is_entailment
Joe has sold his house and bought a new one a few miles away. He will be moving out of it on Thursday.,He will be moving out of The old house on Thursday.,1,12.811437606811523,0.8287662863731384,2.3798258,binary,is_entailment
Mark heard Steve's feet going down the ladder. The door of the shop closed after him. He ran to look out the window.,The door of the shop closed after Mark.,0,12.158981323242188,0.8490403294563293,2.2038543,binary,is_entailment
"It is not easy to space buttonholes exactly the same distance apart, and it is very difficult to cut them precisely the right size. The tiniest slip of the scissors will make the hole too large, and even one thread uncut will leave it too small.",Even one thread uncut will leave the right size too small.,0,8.330338478088379,0.8735953569412231,1.6279404,binary,is_entailment
Billy cried because Toby wouldn't accept his toy.,Billy cried because Toby wouldn't accept Toby's toy.,0,9.885852813720703,0.9999999403953552,0.0,binary,is_entailment
"As Ollie carried Tommy up the long winding steps, his legs dangled.",Ollie's legs dangled.,0,9.062009811401367,0.639083981513977,3.9252677,binary,is_entailment
"Sam pulled up a chair to the piano, but it was broken, so he had to sing instead.","The chair was broken, so he had to sing instead.",0,11.110637664794922,0.8975023031234741,1.6346362,binary,is_entailment
The fish ate the worm. It was hungry.,The worm was hungry.,0,17.52477264404297,0.8261603116989136,2.7533588,binary,is_entailment
"The journalists interviewed the stars of the new movie. They were very cooperative, so the interview lasted for a long time.","The journalists were very cooperative, so the interview lasted for a long time.",0,10.870335578918457,0.9066153168678284,1.5237349,binary,is_entailment
The trophy doesn't fit into the brown suitcase because it is too small.,The trophy is too small.,0,13.735482215881348,0.7831045389175415,3.0557704,binary,is_entailment
Thomson visited Cooper's grave in 1765. At that date he had been travelling for five years.,Cooper had been travelling for five years.,0,7.374777793884277,0.6777190566062927,2.7209535,binary,is_entailment
"Alice was dusting the living room and trying to find the button that Mama had hidden. No time today to look at old pictures in her favorite photo album. Today she had to hunt for a button, so she put the album on a chair without even opening it.",She put the album on a chair without even opening the living room.,0,9.283123970031738,0.8166124224662781,2.2581298,binary,is_entailment
Bill passed the half-empty plate to John because he was full.,Bill was full.,1,0.0,0.0,3.157825,binary,is_entailment
Bill passed the half-empty plate to John because he was full.,John was full.,0,12.248273849487305,0.5644587278366089,5.7178226,binary,is_entailment
The foxes are getting in at night and attacking the chickens. I shall have to kill them.,I shall have to kill The foxes.,1,11.848470687866211,0.8078091144561768,2.5491304,binary,is_entailment
"Joe's uncle can still beat him at tennis, even though he is 30 years younger.",Joe is 30 years younger.,1,12.5414400100708,0.8232396841049194,2.3364878,binary,is_entailment
Emma did not pass the ball to Janie although she was open.,She saw that Janie was open.,1,7.414843559265137,0.6599055528640747,2.7669473,binary,is_entailment
Bill passed the gameboy to John because his turn was over.,Bill's turn was over.,1,8.877473831176758,0.5738158226013184,3.9001627,binary,is_entailment
"Ann asked Mary what time the library closes, because she had forgotten.",Ann had forgotten.,1,9.505501747131348,0.7198406457901001,2.8915799,binary,is_entailment
"Pam's parents came home and found her having sex with her boyfriend, Paul. They were furious about it.",Pam's parents were furious about it.,1,11.78844165802002,0.7665431499481201,2.797629,binary,is_entailment
"This morning, Joey built a sand castle on the beach, and put a toy flag in the highest tower, but this afternoon the tide knocked it down.",This afternoon the tide knocked The flag down.,0,8.833910942077637,0.7675522565841675,2.4415112,binary,is_entailment
The man couldn't lift his son because he was so weak.,The man was so weak.,1,15.840349197387695,0.8522704839706421,2.4634938,binary,is_entailment
The customer walked into the bank and stabbed one of the tellers. He was immediately taken to the hospital.,The customer was immediately taken to the hospital.,0,11.555755615234375,0.8290360569953918,2.2783961,binary,is_entailment
"Since Chester was dependent on Uncle Vernon, he couldn't very well marry without his approval",He couldn't very well marry without Chester's approval,0,9.788963317871094,0.7011244297027588,3.4714801,binary,is_entailment
Mama came over and sat down beside Alice. Gently she stroked her hair and let the child weep.,Mama stroked her hair and let the child weep.,1,9.890897750854492,0.9227020144462585,1.3709139,binary,is_entailment
Emma did not pass the ball to Janie although she saw that she was open.,Emma saw that she was open.,1,9.152437210083008,0.7497150897979736,2.5522656,binary,is_entailment
"Mark became absorbed in Blaze, the white horse. He was afraid the stable boys at the Burlington Stables struck at him and bullied him because he was timid, so he took upon himself the feeding and care of the animal.",Mark was afraid the stable boys at the Burlington Stables struck at him and bullied him.,1,5.4274492263793945,0.8177397847175598,1.5685407,binary,is_entailment
"By rolling over in her upper berth, Tatyana could look over the edge of it and see her mother plainly. How very small and straight and rigid she lay in the bunk below! Her eyes were closed, but Tatyana doubted if she slept.",Tatyana doubted if her mother slept.,1,5.201837539672852,0.5913384556770325,2.9265995,binary,is_entailment
James asked Robert for a favor but he was refused.,Robert was refused.,0,15.717456817626953,0.8811590075492859,2.2193527,binary,is_entailment
I can't cut that tree down with that axe; it is too thick.,The axe is too thick.,0,18.176254272460938,0.6656261682510376,4.577274,binary,is_entailment
Bob collapsed on the sidewalk. Soon he saw Carl coming to help. He was very ill.,Bob was very ill.,1,8.091607093811035,0.539993166923523,4.3115077,binary,is_entailment
Emma did not pass the ball to Janie although she saw that she was open.,Janie saw that she was open.,0,7.7929277420043945,0.7411961555480957,2.3351567,binary,is_entailment
Tom gave Ralph a lift to school so he wouldn't have to drive alone.,Tom wouldn't have to drive alone.,1,11.758818626403809,0.7563812732696533,3.0347214,binary,is_entailment
Sam's drawing was hung just above Tina's and it did look much better with another one below it.,Sam's drawing did look much better with another one below it.,1,14.978907585144043,0.9166889786720276,1.6995825,binary,is_entailment
"Although they ran at about the same speed, Sue beat Sally because she had such a good start.",Sue had such a good start.,1,10.612405776977539,0.815149188041687,2.28415,binary,is_entailment
Grace was happy to trade me her sweater for my jacket. She thinks it looks dowdy on her.,The sweater looks dowdy on her.,1,9.675079345703125,0.7879959940910339,2.5139847,binary,is_entailment
Bob paid for Charlie's college education. He is very grateful.,Charlie is very grateful.,1,8.432855606079102,0.47102656960487366,4.393139,binary,is_entailment
Grace was happy to trade me her sweater for my jacket. She thinks it looks great on her.,The sweater looks great on her.,0,11.859609603881836,0.8810189366340637,1.9821398,binary,is_entailment
"Every day after dinner Mr. Schmidt took a long nap. Mark would let him sleep for an hour, then wake him up, scold him, and get him to work. He needed to get him to finish his work, because his work was beautiful.",Mr. Schmidt's work was beautiful.,1,8.1257905960083,0.7060143947601318,2.774157,binary,is_entailment
The man lifted the boy onto his shoulders.,The man lifted the boy onto the man's shoulders.,1,17.082107543945312,1.000000238418579,0.0,binary,is_entailment
"Fred and Alice had very warm down coats, but they were not prepared for the cold in Alaska.",coats were not prepared for the cold in Alaska.,0,11.104924201965332,0.8849281072616577,1.8028411,binary,is_entailment
"In July, Kamtchatka declared war on Yakutsk. Since Yakutsk's army was much better equipped and ten times larger, they were defeated within weeks.",Yakutsk was defeated within weeks.,0,6.792238235473633,0.587965726852417,3.1403217,binary,is_entailment
"Jackson was greatly influenced by Arnold, though he lived two centuries earlier.",Jackson lived two centuries earlier.,0,11.074941635131836,0.8733611702919006,1.8814815,binary,is_entailment
"The path to the lake was blocked, so we couldn't use it.",We couldn't use the lake.,0,16.411903381347656,0.7980479001998901,3.0783918,binary,is_entailment
Sara borrowed the book from the library because she needs it for an article she is working on. She reads it when she gets home from work.,She reads the book when she gets home from work.,1,11.250833511352539,0.922265350818634,1.5302931,binary,is_entailment
The customer walked into the bank and stabbed one of the tellers. He was immediately taken to the police station.,The teller was immediately taken to the police station.,0,12.252135276794434,0.8751354217529297,1.9403366,binary,is_entailment
"Adam can't leave work here until Bob arrives to replace him. If Bob had left home for work on time, he would be here by this time.",Bob would be here by this time.,1,13.428359985351562,0.8328626155853271,2.5892541,binary,is_entailment
What about the time you cut up tulip bulbs in the hamburgers because you thought they were onions?,You thought tulip bulbs were onions?,1,12.735218048095703,0.8969073295593262,1.8901058,binary,is_entailment
