first_sentence,second_sentence,score,dot_score,cos_score,eucl_score,score_type,score_name
Are exocytosis and endocytosis examples of active or passive transport?,What are examples of passive transport in cells?,0,144.121826171875,0.7449504137039185,9.947479,binary,is_duplicate
How i get hair on bald head?,"If I shave my head for 2 years as am getting bald and then grew my hair, will the hair will be same as when I intially have? Or I loose more hair?",0,114.6182632446289,0.5351429581642151,15.089238,binary,is_duplicate
What is the ideal life after retirement?,What's life after retirement?,0,274.7069091796875,0.8949981331825256,8.03137,binary,is_duplicate
What is our stance against Pakistan?,What is the stance of Pakistan in the possession of weapons of mass destruction by North korea? Does it support DPRK or is it against DPRK?,0,160.78839111328125,0.7027232050895691,12.111305,binary,is_duplicate
What are good websites for escorts?,How do I find a good escort?,0,186.78756713867188,0.7713937759399414,10.9434,binary,is_duplicate
Which one is better polo diesel or grand i10 petrol?,What is the best diet for a growing decathlete?,0,26.883129119873047,0.11464640498161316,20.41782,binary,is_duplicate
Does a black hole have mass?,Does a black hole have a finite mass?,1,188.93992614746094,0.8604267835617065,8.098535,binary,is_duplicate
"Is Morgan Freeman correct when he says the only way to stop racism, is to stop talking about it?",What are your views about this Morgan Freeman quote about Racism?,1,132.76426696777344,0.8078101277351379,8.0918255,binary,is_duplicate
Does Fab currently offer new employees stock options or RSUs?,Does Uber currently offer new employees stock options or RSUs?,0,123.30565643310547,0.742755651473999,9.300561,binary,is_duplicate
How would you review the site Waveclues?,Is there a good pay for reviews site out there?,0,57.69374084472656,0.36669519543647766,14.350124,binary,is_duplicate
In how many ways can we distribute 10 identical looking pencils to 4 students so that each student gets at least one pencil?,In how many ways 12 apples can be distributed among 4 children such that every child gets at least 2 apples?,0,100.81175994873047,0.5595521926879883,12.597893,binary,is_duplicate
How much would it cost to hire Jerry Seinfeld for 1-2 hours?,How much on average would it cost to video tape a 2 hour presentation?,0,69.4386215209961,0.45957475900650024,12.880944,binary,is_duplicate
Is 7 days too late for rabies vaccine after a possible non-bite exposure?,Can I take rabies injection after 1 day of dog bite?,0,176.59698486328125,0.7547772526741028,10.864441,binary,is_duplicate
How many years Britain ruled India?,What is the standard amount of time off given for an international relocation?,0,14.953792572021484,0.07453464716672897,19.303764,binary,is_duplicate
How can I stop being afraid of working?,How do you stop being afraid of everything?,0,175.21395874023438,0.650123119354248,13.733319,binary,is_duplicate
Why does Red keep the keys in OITNB?,Why does Red keep the keys in season 4 of Orange is the New Black?,1,114.00593566894531,0.7386052012443542,9.045976,binary,is_duplicate
At what age should someone lose their virginity?,"At what age, how, and where did you lose your virginity?",0,161.15341186523438,0.7737283706665039,9.724713,binary,is_duplicate
How forgetful are you?,How can I forget my wife?,0,68.11437225341797,0.3226865828037262,16.913408,binary,is_duplicate
Could Snoke secretly be Darth Maul?,How could Snoke be Darth Plagueis if he was killed by Emperor Palpatine?,0,65.8205795288086,0.45716652274131775,12.6415615,binary,is_duplicate
"If I do not monetize YouTube videos & upload copyright content, then are there chances that Google may block my account?",How do you upload movies on YouTube and monetize them? Is there any issue of copyright,1,120.58888244628906,0.6798540353775024,10.7367,binary,is_duplicate
Would you switch from Canon 6D to Leica D-LUX 109?,What tripod should I get for my Canon 6D?,0,78.1265640258789,0.5332670211791992,11.712451,binary,is_duplicate
What does the Quora website look like to members of Quora moderation?,How does Quora look to a moderator?,1,114.92918395996094,0.7088362574577332,9.865525,binary,is_duplicate
Why nobody answer my questions in Quora?,Why is no one answering my questions in Quora?,1,223.8238983154297,0.7825235724449158,11.25293,binary,is_duplicate
What is the funniest joke you know?,What is the funniest joke of all time?,1,191.1834716796875,0.9085565805435181,6.2076626,binary,is_duplicate
"I got job offer @ Chelmsford-Essex, London with £3764 PM pay-after tax deduction. Pls advice tentative monthly expenses for couple? & saving possible?","If I am leaving Norway, can I pay down my mortgage with my BSU account, and then sell my apartment without having to pay back the tax deduction I got for having BSU?",0,39.10578918457031,0.27917811274528503,14.21231,binary,is_duplicate
What are stereotypes about the United Kingdom?,What do Americans think about the United Kingdom?,0,116.22962188720703,0.7273787260055542,9.362837,binary,is_duplicate
How do I use Twitter as a business source?,How can I use Twitter for business?,1,240.67958068847656,0.9402732849121094,5.547108,binary,is_duplicate
How can I transfer money from Skrill to a PayPal account?,How can I send money from my PayPal account to my Skrill account to withdraw?,0,208.2674560546875,0.8562376499176025,8.537554,binary,is_duplicate
Which is the best earphone with deep bass under 1000?,Which is the Best earphones under Rs 1000?,1,234.1668701171875,0.870575487613678,8.443123,binary,is_duplicate
Are government employees eligible to Sukanya Samrudi Yojana?,Can a Government employee apply IEC?,0,97.27669525146484,0.45586222410202026,15.333132,binary,is_duplicate
Which is correct - 'Looking forward to speak with you' or 'Look forward to speak with you'?,"""Which is correct: """"speak with"""" or """"speak to""""?""",0,70.37319946289062,0.42145901918411255,13.902213,binary,is_duplicate
Which are the best engineering fields?,What is the best field of engineering?,1,199.2189178466797,0.8748136758804321,7.562281,binary,is_duplicate
How do you make life suit you and stop life from abusing you mentally and emotionally?,"Why are emotionally abusive people in my life? Several ex boyfriends, friends, and past coworkers/bosses have been abusers. Do I attract them?",0,65.99356079101562,0.4093479812145233,13.822973,binary,is_duplicate
What is the difference between gross salary and CTC?,"There seems to be a difference between my weekly paycheck and the yearly salary my employer agreed upon, how does that work?",0,88.32352447509766,0.42605865001678467,15.442325,binary,is_duplicate
Which are the prospering towns in Kerala?,Why are there so many Christians in Kerala?,0,121.52977752685547,0.6318169832229614,11.990738,binary,is_duplicate
What is the best way to gain confidence?,How can I speak with more clarity and confidence?,0,106.84782409667969,0.49614906311035156,14.731732,binary,is_duplicate
Does anyone see the relation between Greek gods and Hindu gods?,"What parallelism can we draw between gods of Hindu mythology, Greek mythology, Egyptian mythology, etc.?",1,131.48609924316406,0.6932390928268433,10.869714,binary,is_duplicate
How do I switch from Apple Music to Spotify?,Should I switch from Spotify to Apple Music?,0,192.67617797851562,0.8769674897193909,7.511591,binary,is_duplicate
Which is the best fixed income fund?,What is the best fixed income fund?,1,212.30252075195312,0.9889472126960754,2.1836388,binary,is_duplicate
What is it like to live in Cologne?,"What is it like to live in Köln, Germany? ",1,134.82618713378906,0.6370553374290466,12.411431,binary,is_duplicate
"Between Robert De Niro and Al Pacino, who is more successful?","Who do you regard as the best actor, Robert De Niro or Al Pacino?",0,125.2568359375,0.7917092442512512,8.152622,binary,is_duplicate
Why does some people prefer small families.?,Why do some people prefer to live with small family?,1,125.20954132080078,0.8630107045173645,6.3407636,binary,is_duplicate
Do animals kiss?,Do animals (besides humans) kiss?,1,242.01869201660156,0.9276330471038818,7.0790725,binary,is_duplicate
How do you get deleted Instagram chats?,How can I view deleted Instagram dms?,1,223.41099548339844,0.8131662607192993,10.161389,binary,is_duplicate
How can I stop being addicted to love?,How do I stop being addicted to someone?,0,188.1486053466797,0.7245900630950928,11.961915,binary,is_duplicate
What if I hired two private eyes and ordered them to follow each other?,Would I be able to hire two private investigators and then get them to follow each other?,1,99.2964096069336,0.6760531067848206,9.760675,binary,is_duplicate
How do I find a startup accelerator?,How do startup accelerators give you the funding?,0,155.6497344970703,0.6874992251396179,11.895394,binary,is_duplicate
How can I check wifi history and access it through android phones?,I cannot open Quora through my WiFi router. Why can I only access it through a mobile network?,0,91.2359390258789,0.44754084944725037,15.165471,binary,is_duplicate
"What was the significance of the battle of Somme, and how did this battle compare and contrast to the Battle of Rostov?","What was the significance of the battle of Somme, and how did this battle compare and contrast to the Battle of Riyadh?",1,210.55731201171875,0.9654683470726013,3.9169288,binary,is_duplicate
What is the most creative college admissions essay you've read?,Has any college admission officer cried in public while reading an applicant's essay?,0,75.5116958618164,0.4495827555656433,13.598408,binary,is_duplicate
"What would happen if you cover one of your eyes with an eye patch for one year, then take the patch off?",What happens if eye medicine enters the eye?,0,106.1177978515625,0.5837244391441345,12.568441,binary,is_duplicate
Is it possible to pursue many different things in life?,How do I refuse to chose between different things to do in my life?,1,153.7850799560547,0.7302285432815552,10.738367,binary,is_duplicate
Did Ben Affleck shine more than Christian Bale as Batman?,"No fanboys please, but who was the true batman, Christian Bale or Ben Affleck?",1,139.1278839111328,0.8092426061630249,8.107173,binary,is_duplicate
Which business is good start up in Hyderabad?,Which business is better to start in Hyderabad?,1,210.20870971679688,0.9354828596115112,5.4028964,binary,is_duplicate
How can I stop being so possessive?,How do I stop being over possessive for a person whom I love?,1,198.48941040039062,0.8371239304542542,8.963444,binary,is_duplicate
Who was the wife of Lord Krishna?,Who is the father of lord Krishna?,0,141.32534790039062,0.7833049297332764,9.0286455,binary,is_duplicate
What is the best combination of courses I can take up along with CA to enhance my career?,What courses must be taken along with CA course?,1,139.38800048828125,0.8393192291259766,7.324431,binary,is_duplicate
How do you take a screenshot on a Mac laptop?,How do I take a screenshot on my MacBook Pro? What are some instructions?,1,178.87611389160156,0.9156485795974731,5.851786,binary,is_duplicate
What is the work of an executive recruiter like?,What is it like to work with an executive recruiter?,0,176.91737365722656,0.9058493375778198,6.110557,binary,is_duplicate
Which psychological need does 'collecting' fulfill?,Why do people collect things?,0,88.82820892333984,0.406471312046051,16.114859,binary,is_duplicate
What are some must watch TV shows before you die?,Are there any must watch TV shows?,1,194.5923614501953,0.8194233179092407,9.263444,binary,is_duplicate
How can I become more fluent in Chinese?,How can I become fluent in chinese?,1,218.2914276123047,0.9836151599884033,2.8609934,binary,is_duplicate
What are the effects of demonitization of 500 and 1000 rupees notes on real estate sector?,What will be the impact of scrapping of ₹500 and ₹1000 rupee notes on the real estate market?,1,174.3081817626953,0.8567408323287964,7.635217,binary,is_duplicate
What is the easiest way to become a billionaire($)?,What is the best way to become a billionaire?,1,250.80604553222656,0.8782135844230652,8.610634,binary,is_duplicate
Are there People who are willing to give free lectures or conduct free workshop in India colleges?,"Almost two weeks in on Prozac, why do I still feel antisocial and still don't want to go to events? Why does my social behavior and mood change daily?",0,-18.13485336303711,-0.12804141640663147,17.966658,binary,is_duplicate
What's the best way to start learning robotics?,What is the best way to start robotics? Which is the best development board that I can start working on it?,0,195.82386779785156,0.8052301406860352,10.30716,binary,is_duplicate
Why do people hate Hillary Clinton?,What are the reasons that people dislike Hillary Clinton?,1,186.97265625,0.8941892385482788,6.8502383,binary,is_duplicate
Why are women who are on their periods are regarded as 'unclean' such that they are prevented in taking an actived part in rituals (Hinduism)?,"Why is it always expected that a woman should take care of housework, children and cooking (especially in Indian culture)? Are these activities the responsibility of women alone? Why do men not share equally in such work?",0,47.23971939086914,0.41339290142059326,11.581732,binary,is_duplicate
"If atheism is the lack of belief in gods, what is the term for the belief that there is no god?","Is atheism the lack of belief in gods, or a claim that god does not exist?",0,141.8782501220703,0.8171501159667969,8.036148,binary,is_duplicate
What is it like to be Jack Dorsey?,What is Jack Dorsey like?,0,194.1817169189453,0.8557575941085815,8.113163,binary,is_duplicate
What are the best quotes/lessons of the Assassin's Creed series?,Which assassin has the best robes in Assassin's Creed?,0,108.56580352783203,0.5271331667900085,13.957071,binary,is_duplicate
"Do inkjet printers use color ink when printing black and white documents? If so, why?","If CMYK printers create black by using colored ink and only complementing with black ink, why do shops charge more for color prints?",0,99.68817138671875,0.7749900817871094,7.7272162,binary,is_duplicate
Why is creativity important?,Why creativity is important?,1,248.84051513671875,0.9890906810760498,2.3454971,binary,is_duplicate
If Hillary Clinton could not continue her Presidential campaign how would the Democratic Party choose a new candidate?,If Hillary Clinton can no longer serve as the Democratic nominee how would her successor be chosen?,1,143.8775634765625,0.8106259703636169,8.211183,binary,is_duplicate
How headphones work as an Antenna to play FM radio channels on Mobile phones? Why mobile companies doesn't install the same inbuilt Antenna on phones to be able to play FM without the headphones?,Why don't phones have a built-in FM antenna?,0,71.6363525390625,0.49703124165534973,12.041051,binary,is_duplicate
What are the best career growth technologies for automation engineers apart from automation tools?,Himalayan or Duke KTM 200 for touring?,0,22.268543243408203,0.09294729679822922,20.862568,binary,is_duplicate
What are the disadvantages of listing a company in NSE?,What are the benefits of listing a company in NSE?,0,161.95675659179688,0.886678159236908,6.4494457,binary,is_duplicate
How many derivatives of an object's position with respect to time have to be continuous?,When does drawing become fun?,0,11.928383827209473,0.06416316330432892,18.98285,binary,is_duplicate
Is the neutron star made up of?,Is the neutron star made up of only neutrons?,1,162.51995849609375,0.936087965965271,4.7108974,binary,is_duplicate
I got a 3.8 GPA. Is it enough to get into top universities like Harvard?,Is a 3.8 GPA sufficient to get into a top school?,1,106.20856475830078,0.7963399291038513,7.389504,binary,is_duplicate
What is a profitable way to trade binary options?,What is binary options trading?,0,166.16534423828125,0.7126959562301636,11.686397,binary,is_duplicate
How do I utilize free time to avoid depression?,Can a person graduating from IIMs like LIK and even the new IIMs like Ranchi and Trichy ever catch up to the graduates from ABC and get a similar package?,0,-16.58871078491211,-0.08694221824407578,21.158194,binary,is_duplicate
How can I learn computer security?,How can I get started to learn information security?,1,204.6277618408203,0.8154696226119995,9.744977,binary,is_duplicate
How do I earn from Quora?,Can I earn money on Quora?,1,251.57447814941406,0.9016465544700623,7.4244013,binary,is_duplicate
What is my puk code?,What's the PUK for TF64SIMC4?,1,163.3006134033203,0.6964374780654907,12.418006,binary,is_duplicate
How can I find job in Japan?,How can I find an IT job in Japan?,0,136.3413848876953,0.7977696061134338,8.548905,binary,is_duplicate
"""What are some examples of sentences using the word """"hysteria""""?""",What is the best home wireless network setup and expected speeds?,0,-11.268437385559082,-0.055473390966653824,20.845383,binary,is_duplicate
Will there be another billion dollar lottery Jackpot?,When will the lottery reach the next billion dollar jackpot?,1,175.6755828857422,0.8634690642356873,7.4603577,binary,is_duplicate
How scary is it to drive on the road to Hana given all of the turns?,Do I need a four-wheel-drive car to drive all the way on the Road to Hana?,0,80.41624450683594,0.5901950597763062,10.627963,binary,is_duplicate
How do I create a new shell in a new terminal using C programming (Linux terminal)?,How do I create a new Terminal and new shell in Linux using C programming?,1,193.13308715820312,0.9160439968109131,5.9512587,binary,is_duplicate
Does cognition affect perception?,Does cognitive strain affect digestion?,0,138.4666748046875,0.5296482443809509,15.821855,binary,is_duplicate
How TQWL is different from CKWL (Tatkal waiting list)?,I have made a railway reservation but got it on the Tatkal waiting list. Will I get a refund if I cancel it?,0,19.9912166595459,0.14083412289619446,15.621812,binary,is_duplicate
How can we make the world a better place to live in for the future generations?,What can I do to make the world a better place?,1,154.18032836914062,0.8308724164962769,8.009481,binary,is_duplicate
How many Champions are there in League of Legends?,Who is the best LoL (League of Legends) champion?,0,124.022216796875,0.5987951159477234,12.987391,binary,is_duplicate
Is drinking 4 liters of water each day unhealthy?,How many liters of water should I drink if I run 5kms daily?,0,145.54885864257812,0.7144380211830139,10.836107,binary,is_duplicate
"Where does the water from the Great Lakes come from, and how does these lakes wildlife compare to Lake Prespa?","Where does the water from the Great Lakes come from, and how does these lakes wildlife compare to Lake Como?",0,160.36376953125,0.9419315457344055,4.4776626,binary,is_duplicate
Do porn stars watch porn?,How can I book Ronda Rousey to star in an adult movie?,0,51.46925354003906,0.26972827315330505,17.43809,binary,is_duplicate
"Trump supporters, how do you feel about the way he's walking back his promises?",Do Trump supporters now expect the president to live up to his promises he so forcefully sold them on?,0,113.3589096069336,0.678984522819519,10.535604,binary,is_duplicate
Why are we worried about others' opinions?,Why do we care for others' opinion and about what others think about us?,1,146.7099609375,0.746539831161499,9.98099,binary,is_duplicate
How do you potty train a 4 months Pitbull?,How do I potty train my two-month-old Labrador pup?,1,177.41983032226562,0.851758599281311,7.909236,binary,is_duplicate
"If I jump rope for five minutes, how many calories will I use?",What's the best way to jump rope?,0,147.42584228515625,0.6719966530799866,12.201459,binary,is_duplicate
Which online test series is best for GATE 2017 in CS stream?,Which test series is the best for GATE computer science stream?,1,141.10301208496094,0.7692099809646606,9.223658,binary,is_duplicate
What is the best material for understanding algorithmic analysis by a newbie?,What math does a complete newbie need to understand algorithms for computer programming? What books on algorithms are suitable for a complete beginner?,0,119.05782318115234,0.6648005843162537,10.957224,binary,is_duplicate
What is the temperament of a Bullmastiff/Husky mix?,What is the temperament of a Corgi-Husky mix?,0,130.9241485595703,0.8901422023773193,5.7290683,binary,is_duplicate
"There are 8 balls. 7 of them weigh the same. 1 of them has a different weight, (you don't know if it's heavier or lighter). How do you find the odd ball with 2 weighs?","How many 4 digit numbers can be formed by using 0, 1, 2, 3, 4, 5, 6, and 7? How many of them are between 4000 and 6000?",0,54.59268569946289,0.31025460362434387,15.609558,binary,is_duplicate
"""In the play """"A Raisin in the Sun"""", why do Walter ad Beneatha argue?""","""In """"A Raisin in the Sun"""", why do Walter and Beneatha argue?""",1,93.49784088134766,0.9161132574081421,4.144731,binary,is_duplicate
What are the signs of an ultra smart person playing dumb?,What are signs of ultra smart people hiding their intelligence?,1,135.12310791015625,0.7365491390228271,9.8848095,binary,is_duplicate
If dark energy is created with expansion can infinite of it be created?,"If energy is not conserved in an expanding universe, is potential energy infinite (the energy that can be created is infinite)?",1,201.2574462890625,0.8642198443412781,8.02632,binary,is_duplicate
How do you get a book published?,What are the good ways to write and publish a book?,0,169.9523468017578,0.7401662468910217,11.032182,binary,is_duplicate
Who is disrupting Bloomberg?,Who will disrupt Bloomberg?,1,247.0890350341797,0.9154831171035767,6.8612857,binary,is_duplicate
Why can flash run so fast?,The Flash (DC character): How fast can the Flash run a mile?,0,129.265869140625,0.7035560607910156,10.688055,binary,is_duplicate
"What is the best way to invest $500 legally so that I can get tangible profits over a relatively short period of time, say 6 months?",How can I best invest ₹5000 over the next 6 months?,0,98.3683853149414,0.6306266784667969,10.735807,binary,is_duplicate
How will the implementation of GST bill impact the lives of common people?,What exactly is GST bill and how exactly will it affect the common people?,1,170.09165954589844,0.881866455078125,7.066545,binary,is_duplicate
How can you recover your Gmail password?,"I do not remember my password to my Gmail account, how can I recover my account?",1,292.8539733886719,0.91904616355896,7.5722723,binary,is_duplicate
How accurately can a mental illness can be diagnosed?,How can I accurately diagnose and medicate my mental illness?,1,152.8645477294922,0.842288076877594,7.566699,binary,is_duplicate
Is knee pain in a 20 year old girl normal?,Is it normal for a 14 year old girl to be spitting up blood?,0,36.88348388671875,0.21102577447891235,16.608046,binary,is_duplicate
What are the qualities of a good leader?,What are some good qualities of a leader?,1,196.6057891845703,0.9232919812202454,5.7483945,binary,is_duplicate
"What is the difference between bay, gulf and straits?",What exactly is the difference between a sea and a bay?,0,191.66603088378906,0.8142148852348328,9.453711,binary,is_duplicate
Will Modi win in 2019?,Can Narendra Modi become Prime Minister of India in 2019?,1,168.77259826660156,0.7996328473091125,9.228471,binary,is_duplicate
How can I open DMart store in India? Is there any franchise for that?,How do I get reliance digital store franchise?,0,97.82340240478516,0.545974612236023,12.831934,binary,is_duplicate
What are the best YouTube channels to learn medicine?,What are some of the best YouTube channels for learning Git?,0,159.2318572998047,0.6375662088394165,13.537804,binary,is_duplicate
Did Swami Vivekananda ever eat non-veg or egg during his journey around the world?,Why don't most of the Hindus eat non-veg?,0,79.01786041259766,0.5625091195106506,11.129677,binary,is_duplicate
What will happen if I cancel TQWL tickets before the charting is done?,Can we cancel a 'Tatkal waiting list' ticket?,0,96.85698699951172,0.5946686267852783,11.491675,binary,is_duplicate
"""What exactly is the """"Common Core Initiative/Standards"""" and what are the pros and cons?""",What are the pros and cons of the Common Core Standards Initiative?,1,106.3580093383789,0.7619660496711731,8.421845,binary,is_duplicate
How do I choose a journal to publish my paper?,Where do I publish my paper?,1,165.2032928466797,0.7591319680213928,10.25786,binary,is_duplicate
What are your New Year's resolutions for 2017?,What is your creative New Year's resolution for 2017?,1,326.3526306152344,0.9663654565811157,4.780038,binary,is_duplicate
What do you do if you had a bad dream?,How do you not get bad dreams?,0,140.46717834472656,0.6987867951393127,11.357869,binary,is_duplicate
Why do Slavs squat?,Do squats work for men?,0,110.48377227783203,0.5202872157096863,14.337386,binary,is_duplicate
How many marks should I score for AIIMS rank 151?,What minimum marks should I score to get among top 50 in AIIMS?,0,147.66104125976562,0.8204940557479858,8.054662,binary,is_duplicate
"In an operating room, when two surgeons of equal experience disagree on a surgical procedure, how is the tie broken?",Doctors: How do surgeons hold out on surgeries more than 6 hours long? Do they rest during the operation?,0,73.77539825439453,0.43076932430267334,13.964161,binary,is_duplicate
How many months does it take to gain knowledge in developing Android apps from scratch?,How much time does it take to learn Android app development from scratch?,1,179.21820068359375,0.9164060354232788,5.7641973,binary,is_duplicate
How do I love my body as a guy?,"How can I make my whole body more fair, if I am a wheatish Indian guy?",0,101.11883544921875,0.5190173983573914,14.009422,binary,is_duplicate
What are the rights of a prisoner?,"If I am in prison, what rights would I have?",1,155.12937927246094,0.6450983881950378,13.113212,binary,is_duplicate
