first_sentence,second_sentence,score,dot_score,cos_score,eucl_score,score_type,score_name
How can I get free gems in Clash of Clans?,How can I get free gems Clash of Clans?,1,191.46432495117188,0.9715999364852905,3.3792224,binary,is_duplicate
Why aren't there more apps like Word Lens?,What does Word Lens use for OCR?,0,89.50093078613281,0.4660928249359131,14.360723,binary,is_duplicate
My ex-girlfriend is suffering from malaria. I have a deep urge of visiting her but I have my placements on. I have no idea how to be with her. What should I do?,"Should I be worried that my girlfriend texts her ex-boyfriend till 4 a.m., and if so, why?",0,40.560611724853516,0.32263535261154175,13.054394,binary,is_duplicate
What is the best way to get traffic on your website?,How do i get traffic for website?,1,198.0775146484375,0.8663774132728577,7.8399773,binary,is_duplicate
How do you feel when someone upvotes your answer on Quora?,How does it feel to see upvotes to your answer on Quora?,1,183.9135284423828,0.9058353900909424,6.207994,binary,is_duplicate
What are some of the best films and TV shows that feature strong female protagonists?,What are the best female strong characters in films?,1,165.1232147216797,0.7913926243782043,9.444107,binary,is_duplicate
How far would you go for love? Should I wait for the one I love ir move on?,"As a thirteen year old, what is the best thing I can do for my health?",0,-3.766162872314453,-0.022393006831407547,18.820034,binary,is_duplicate
How do most people die?,How do people die?,0,233.42311096191406,0.9074841141700745,7.0264506,binary,is_duplicate
Why are most clothes made of polyester now instead of cotton?,How are cotton clothes made?,0,180.50633239746094,0.7993407249450684,10.01403,binary,is_duplicate
What is in bone marrow?,What does bone marrow taste like?,0,161.9779815673828,0.7165740132331848,11.330911,binary,is_duplicate
Were there any slave with the name Reddice?,"In Ancient Rome, slaves were branded. What happened with the brand mark if they were subsequently liberated?",0,76.66509246826172,0.47220808267593384,13.181491,binary,is_duplicate
How long does it take for a dead body to float to the surface after drowning ?,"When a dead body is in a river, how long does it take before it floats?",1,133.0864715576172,0.7642964124679565,9.060681,binary,is_duplicate
How do I get over a friend with whom I haven't talked in 3 years but still miss him?,How do I get over someone I loved now that we broke up last year and I still miss her?,0,120.47515869140625,0.6093188524246216,12.506981,binary,is_duplicate
When travelling to a new region is it better to immerse yourself in 1–2 cities or to see as many cities as you can cram in?,What are the ways to explore world without spending more money?,0,48.66478729248047,0.28944268822669983,15.572622,binary,is_duplicate
How can I make money online with free of cost?,How do I to make money online?,1,191.4867401123047,0.7924308776855469,10.150885,binary,is_duplicate
Where can I buy best quality customized cupcakes in Gold Coast?,Where can I find delicious cupcakes at Gold Coast?,1,197.48033142089844,0.9110531210899353,6.2165313,binary,is_duplicate
How successful was odd even plan?,How successful was the Delhi's Odd-even plan?,1,91.7789306640625,0.6321613788604736,10.387242,binary,is_duplicate
If there will be a war between India and Pakistan who will win?,Who will win if a war starts between India and Pakistan?,1,293.1708984375,0.8987540006637573,8.286627,binary,is_duplicate
How do you deal with a fear of dying?,How can you reduce your fear of dying?,1,165.10784912109375,0.8763371706008911,6.878861,binary,is_duplicate
What would be the estimated cost of repairing the cracked screen of iphone 6?,What is the price I have to pay for repairing a broken iPhone 6 screen? How can it be done?,0,122.80776977539062,0.8244006037712097,7.359062,binary,is_duplicate
What are the most interesting products and innovations that McDonald's is coming out with in 2016?,What are the most interesting products and innovations that Ball is coming out with in 2016?,0,130.57870483398438,0.7268452644348145,9.916643,binary,is_duplicate
"Is there an end to the universe, and if not, is the universe infinite?",Is the Universe infinite or is there an end to the Universe?,1,211.9099884033203,0.9582559466362,4.552905,binary,is_duplicate
What is CPAGrip.com?,What is bestmytest.com?,0,62.247135162353516,0.3209569454193115,16.232922,binary,is_duplicate
How much funds should I raise?,How much money should I raise?,1,180.90264892578125,0.9037073850631714,6.2389903,binary,is_duplicate
What Anna Hazare think about PM Modi?,What do you people think of Mr. Arvind Kejriwal and his AAP?,0,45.20839309692383,0.3054898977279663,14.458345,binary,is_duplicate
What will be the effect of banning 500 and 1000 notes on stock markets in India?,What will be the effect of the ban of the 1000rs and 500rs notes on the stock market?,1,148.8472137451172,0.8495286703109741,7.277028,binary,is_duplicate
How does concentric contractions differ from eccentric contractions?,How do concentric and eccentric contraction compare and contrast?,1,175.294677734375,0.8864089250564575,6.715021,binary,is_duplicate
Why did the puppet they used for Yoda in Episode I suck so bad?,"""Why do people not question """"news"""" posts and opinions posted on social media websites?""",0,11.025715827941895,0.07169771194458008,16.93434,binary,is_duplicate
On what online platforms can I post ads for beer money opportunity?,What online platforms can I post ads for beer money opportunity?,0,234.41123962402344,0.9924730062484741,2.090289,binary,is_duplicate
What the meaning of this all life?,What's are the meaning of life?,1,249.76058959960938,0.8977031111717224,7.6522846,binary,is_duplicate
How should I start small business effectively?,How should I start a small business in construction?,0,140.57772827148438,0.7621440291404724,9.369418,binary,is_duplicate
How can we acquire a positive morality?,What are time deposits? Are RD and FD types of time deposits?,0,-10.205007553100586,-0.048542752861976624,21.006092,binary,is_duplicate
Do you need friends?,Why do we need friends?,0,162.4659881591797,0.7693723440170288,9.870563,binary,is_duplicate
Do I exist?,Do we exist?,0,225.2493438720703,0.7791693210601807,11.360583,binary,is_duplicate
Which are the best Hollywood thriller movies?,What are the best thriller movie in Hollywood?,1,231.64036560058594,0.9368888735771179,5.5945973,binary,is_duplicate
"Should I repeat 2nd year in college, or find a new college? It's a 5 year course.",I study in Ashutosh College in Kolkata. Can I study in any other college in India in my 2nd year?,0,65.48721313476562,0.45761874318122864,12.631148,binary,is_duplicate
How is petrol or diesel pumped up in a filling station using a motor without igniting any fire?,What happens when you fill a petrol car with diesel? What is the solution if such an incident happened?,0,129.75230407714844,0.7656925320625305,8.942399,binary,is_duplicate
What job possibilities exist for a Bachelors in Homeland Security?,What jobs are available with a bachelor’s degree in Homeland Security?,1,187.52606201171875,0.9211205840110779,5.7373557,binary,is_duplicate
Which are the best books to understand calculus?,What are good books to self study calculus?,1,250.48939514160156,0.9271715879440308,6.2982283,binary,is_duplicate
Why and how did you break up with her/him?,How and why did you break up with your ex?,1,150.49676513671875,0.731341540813446,10.563242,binary,is_duplicate
Can I use Jio SIM in iPhone 5s?,Does iPhone 5S support JIO VoLTE?,0,118.38298034667969,0.6053569316864014,12.425094,binary,is_duplicate
What are some unwritten rules in USA?,What are some unwritten rules you have for your home?,0,158.96055603027344,0.6964849233627319,11.810966,binary,is_duplicate
What is the best answer to what you did in two years gap in a job interview?,What is the best excuse to explain a gap (of one or two years) in your job career for a job interview?,1,103.49205017089844,0.7311457395553589,8.853039,binary,is_duplicate
What are the best songs for low voices?,What are some songs for a sweet airy mezzo voice?,0,162.12710571289062,0.6422895789146423,13.484145,binary,is_duplicate
Can anyone predict my birth chart?,What can you tell me regarding this birth chart?,0,177.3637237548828,0.7857052087783813,10.206767,binary,is_duplicate
When was the birth of the trigonometric functions?,Who were the creators of trigonometry?,0,131.4447784423828,0.7638216018676758,9.054934,binary,is_duplicate
"""What does this saying mean; """"Don't trust everything you see even salt looks like sugar""""?""","""People say """"don't try to please others."""" Does being nice to others mean pleasing them?""",0,74.00957489013672,0.4653840959072113,13.485408,binary,is_duplicate
What do countries do to prevent war?,How should countries prevent war?,1,288.509765625,0.9177953004837036,7.1904554,binary,is_duplicate
How can I become a billionaire?,How can I become a billionaire (in finance)?,1,265.150634765625,0.8958199620246887,8.533004,binary,is_duplicate
Why should I learn web design?,How can I learn about web design?,0,217.771484375,0.914050281047821,6.4225163,binary,is_duplicate
"What's the best on-line calender/scheduling/booking system? Something that allows me to show my availability & customers can 'request' to meet me. When I 'accept' their request, the appointment pops into our calendars & reminders are automated.",Is there a web service that can send appointment sms-reminders to customers extracting data from Google calendar?,0,79.51113891601562,0.5135207176208496,12.397559,binary,is_duplicate
How will Indian GDP be affected from banning 500 and 1000 rupees notes?,What will be the implications of banning 500 and 1000 rupees currency notes on Indian economy?,1,259.86505126953125,0.8829841613769531,8.318319,binary,is_duplicate
Why does understanding death philosophical?,What makes understanding death philosophical?,1,198.69265747070312,0.9719787836074829,3.4045455,binary,is_duplicate
Why are dogs considered omnivores?,Are dogs carnivorous animals?,1,176.64089965820312,0.7409432530403137,11.265009,binary,is_duplicate
What it is like to be cheated upon in a relationship?,What is it like to be in a relationship with someone you cheated with?,0,217.5939483642578,0.8727421760559082,7.9787736,binary,is_duplicate
How do I know if someone blocked my texts?,If I turn of my user id off can I text someone that blocked me?,0,173.82679748535156,0.7093325853347778,12.019232,binary,is_duplicate
What are the most interesting foods you have eaten in any country?,What is the most delicious dish you've ever eaten and why?,1,154.07647705078125,0.6937984228134155,11.661943,binary,is_duplicate
What is it like to be a private banker?,What is like to be a private banker in Switzerland?,0,192.43930053710938,0.8363610506057739,8.686844,binary,is_duplicate
What is journalism for you?,What is journalism?,0,268.79510498046875,0.90491783618927,7.7880487,binary,is_duplicate
How can one increase concentration?,How can I improve my concentration?,1,204.3999786376953,0.8655758500099182,7.9775295,binary,is_duplicate
"""How do I see """"sent invitations"""" on Linkedin if I don't have any more pending invitations?""","How can you personalize a LinkedIn invitation? I think I just sent a colleague an invitation on LinkedIn, but did not get a chance to personalize it!",0,110.36215209960938,0.7040821313858032,9.632112,binary,is_duplicate
What are the pros and cons of the German Shepherd dog?,What are the pros and cons of having a pet German Shepherd?,1,135.91055297851562,0.8873189687728882,5.8842444,binary,is_duplicate
What is the difference between deism and agnosticism?,What is the difference between a hobby and a habit?,0,41.181644439697266,0.17455129325389862,19.741009,binary,is_duplicate
Why do male porn stars masturbate to ejaculate?,Is it OK for a husband and wife to masturbate together? Is it considered cheating if your partner is masturbating without your consent?,0,78.01866149902344,0.3899954557418823,15.627467,binary,is_duplicate
How much CGPA I require to get an admission for MTech CSE at IIT Madras?,Can I get a job in a consulting firm after Mtech in CSE from IIT?,0,63.274532318115234,0.49632129073143005,11.350829,binary,is_duplicate
Is there a biological reason that people cry when they are emotional?,What is the biological reason for crying?,0,144.51138305664062,0.6725301146507263,11.877279,binary,is_duplicate
What are 5 facts about the earth's crust?,How does the Earth's core affect its crust?,0,166.7982940673828,0.694907546043396,12.138906,binary,is_duplicate
Why does ISRO not use friction stir welding technology?,Should a guy re-evaluate his current relationship and feelings if he's worried about temptation hanging out with a girl that he was friends with?,0,-20.342918395996094,-0.12301316112279892,19.42491,binary,is_duplicate
I wish to simulate a fake location for an app running on my iOS device. How do you fake a GPS location for iOS without jailbreaking as a non-coder?,How can I fake my iPhone location without jailbreaking?,0,133.42286682128906,0.7011024951934814,11.343554,binary,is_duplicate
What would be the best way to quit smoking?,How did you quit/stop smoking?,1,220.25096130371094,0.8862496614456177,7.523835,binary,is_duplicate
Which is the best programing language for tcs?,Which is the best programming language?,0,156.06922912597656,0.5329143404960632,16.627874,binary,is_duplicate
Earthquake resistant homes?,How do earthquake resistant buildings work?,1,185.33297729492188,0.745208740234375,11.264186,binary,is_duplicate
Is Kristen Stewart a bad actress?  Why or why not?,Is Jennifer Lawrence a bad actress?,0,137.21270751953125,0.6857120394706726,11.330926,binary,is_duplicate
Why do some Japanese guys try to look feminine? Don't the girls find it gross?,Why have most of the guys in India become so desperate? Don't they know that girls don't always look for relationships? Would it hurt guys to become our friend first?,0,28.825918197631836,0.24672378599643707,13.549939,binary,is_duplicate
What are the five most popular sugar daddy websites?,What is it like to date a cougar or a sugar daddy?,0,55.98958206176758,0.26038551330566406,17.85646,binary,is_duplicate
What is the VTU 1st sem exam time table of 2016 (Dec)?,How do I frame my time table for 4 months to crack Gate 2016?,0,85.118408203125,0.4708753228187561,13.853542,binary,is_duplicate
What is the best phone to buy below 15k?,Which are best mobile phones to buy under 15000?,1,222.06405639648438,0.871307909488678,8.339429,binary,is_duplicate
How do we start a business?,How do I start business from nothing?,1,185.2316131591797,0.7790313363075256,10.258152,binary,is_duplicate
What's the best near-death experience you've ever had?,Has anyone ever had a near-death experience?,1,161.03382873535156,0.8644984364509583,7.189749,binary,is_duplicate
Why do I keep getting fleas from my dogs?,How can I keep my dog from getting fleas?,1,196.24359130859375,0.847439706325531,8.509053,binary,is_duplicate
What year did the letter J come?,When was the Letter J created?,1,195.48373413085938,0.9465135335922241,4.9329762,binary,is_duplicate
Harvard College Courses: What is general shopping advice for Turkish classes?,Harvard College Courses: What is general shopping advice for Tamil classes?,0,127.72447204589844,0.7162261605262756,10.06112,binary,is_duplicate
How do I send message from one Android phone to another Android phone through bluetooth?,How do I transfer my contacts from one Android phone to another Android phone?,0,195.839599609375,0.6326407790184021,15.088879,binary,is_duplicate
What are the most important books ever written?,What is the most important book you have ever read?,1,189.49537658691406,0.8152800798416138,9.387542,binary,is_duplicate
What universities does Sigma Designs recruit new grads from? What majors are they looking for?,What universities does Sigma-Aldrich recruit new grads from? What majors are they looking for?,0,162.44189453125,0.9280916452407837,5.067173,binary,is_duplicate
Can we do an M.Phil in India after doing Masters in UK (MA in Psychology)?,I'm a masters student interested to work in Humanitarian sector. What are the skills required? I'm a medical doctor doing my masters in UK,0,50.6430549621582,0.3041583001613617,15.222878,binary,is_duplicate
What universities does Powell Industries recruit new grads from? What majors are they looking for?,What universities does Chart Industries recruit new grads from? What majors are they looking for?,0,103.73151397705078,0.6224082112312317,11.232652,binary,is_duplicate
What are some of the best movie posters you have come across?,What are the best & iconic movie posters?,0,221.794677734375,0.8805745244026184,8.035304,binary,is_duplicate
What are some examples of deuteromycota and how are they formed?,Could all bitcoin mining be done by a single Raspberry Pi?,0,22.63918685913086,0.13696494698524475,16.950363,binary,is_duplicate
How racist is too racist?,How racist are you?,0,164.90151977539062,0.7637971043586731,10.196118,binary,is_duplicate
Are there any differences between however and nevertheless?,What's the difference between between and among?,0,88.11487579345703,0.4387566149234772,15.049777,binary,is_duplicate
Are Canada Geese really Canadian?,What do Canadians call Canada?,0,167.37937927246094,0.5904445052146912,15.277843,binary,is_duplicate
How do I find the zeros of the polynomial function [math]f(x)=\dfrac{1}{2}x^{3}-3x[/math]?,How would you find the zero of the function for [math]y=\frac{4x^2 - 36x}{ x-9}[/math]?,0,107.55693817138672,0.8342982530593872,6.5652733,binary,is_duplicate
How do I edit my devices on my Google play account?,How do I add a second device to a Google Play account?,0,171.61244201660156,0.7491359710693359,10.802765,binary,is_duplicate
How can I become a good speaker?,What should I do to be a good Speaker?,1,184.56948852539062,0.934962272644043,5.0701504,binary,is_duplicate
How can I write a letter to Mr. Narendra Modi?,How can I write to Narendra Modi?,1,201.97036743164062,0.8874905109405518,7.327906,binary,is_duplicate
Who is more electable in a general Presidential election: Donald Trump or Ted Cruz?,Who is more delusional: Donald Trump or Ted Cruz?,0,159.68370056152344,0.7851963639259338,9.350459,binary,is_duplicate
Why do they name bastards Snow?,"If Jon Snow is not Ned's bastard, why does Lady Catelyn hate him so much?",0,64.6920394897461,0.4387190639972687,13.307282,binary,is_duplicate
What do you think about the Bermuda Triangle?,What are your theories about Bermuda Triangle?,1,201.56773376464844,0.9119161367416382,6.3675385,binary,is_duplicate
Do Mexican girls like black guys?,Do girls like black guys with no beard?,0,144.41026306152344,0.6549713015556335,12.471968,binary,is_duplicate
Have you lived in a tiny house?,Would you live in a tiny house?,0,144.49148559570312,0.8568083047866821,6.9543004,binary,is_duplicate
"What is a boy/girl called when he/she is 1-6 years old, 6-11years old, 11-14 years old, and 14-18 years old?",I am an 18 years old boy and I love a girl who's 14 years old. We both live Tamil Nadu. Is this a time to propose to her?,0,28.58585548400879,0.21283680200576782,14.548202,binary,is_duplicate
Can you debeak cockerels at 8 months old?,How much and with what should I feed my 3 months old raven?,0,60.944122314453125,0.3195231258869171,16.117722,binary,is_duplicate
What should someone do to overcome anxiety?,What should I do to avoid depression and anxiety?,1,226.5524139404297,0.7925752401351929,10.890637,binary,is_duplicate
How do we avoid whey in Yogurt?,Is bad breath a sign of a strong stomach?,0,56.58761978149414,0.23420846462249756,19.426107,binary,is_duplicate
"Im in love with my bisexual best friend who is also a guy and has a girlfriend, and I want to tell him. How do I move on?","I'm a girl and I'm in love my best friend (who is also a girl), what should I do?",0,81.43887329101562,0.5106448531150818,12.502404,binary,is_duplicate
What is the best university in Germany for an MS?,Which are the best universities in Germany for getting a degree in mechanical engineering?,0,154.9873046875,0.7482637166976929,10.27591,binary,is_duplicate
How do I maintain my peace of mind?,How can I maintain my peace of mind?,1,245.0609893798828,0.9941690564155579,1.6956929,binary,is_duplicate
Which car has good build quality in india?,Is Volkswagen a good reliable car?,0,127.23811340332031,0.5429001450538635,14.638412,binary,is_duplicate
Why does massaging one's temples soothe a migraine or headache?,What are the causes and most effective ways to treat or cure migraine headaches?,0,99.50171661376953,0.6197165250778198,11.0849,binary,is_duplicate
Which one is better among KMC Manipal and KMC Mangalore?,What is the brief comparison of KMC in Manipal and Mangalore?,1,134.76402282714844,0.8508778810501099,7.071246,binary,is_duplicate
Why are my bestfriend still ignoring me?,What should I do when my bestfriend is ignoring me?,0,171.36135864257812,0.9034845232963562,6.0513763,binary,is_duplicate
What are the sensors available in Acer Liquid Z630S Android Smart phone by using CPU-Z App?,Which useful Android phone apps are not available in the Google Play store?,0,56.49076461791992,0.31541183590888977,15.742292,binary,is_duplicate
How do I keep motivation to learn a language?,How do you keep motivated when you learn a new language?,1,182.4086456298828,0.8682260513305664,7.4645853,binary,is_duplicate
What are the top assessment companies in India?,Which are the top firms in Skills assessment industry in India and Globally?,0,142.93820190429688,0.7458519339561462,10.142677,binary,is_duplicate
What does @ mean as an emoticon?,Emoticons: What does “:/” mean?,0,156.52716064453125,0.6662973165512085,12.78032,binary,is_duplicate
Is a pinkish discharge normal in early pregnancy? What causes it?,What did nicholas piramal do with 17500 cr?,0,4.913174152374268,0.029562555253505707,18.275642,binary,is_duplicate
What are the best ways to properly finger yourself?,What would be the best way of keeping yourself amused in a prison?,0,72.97645568847656,0.31997033953666687,17.61563,binary,is_duplicate
How do scientists work?,Where do scientists work?,0,219.42088317871094,0.8982437252998352,7.050791,binary,is_duplicate
How many sponsored candidates are shortlisted for CMC vellore?,"What is the office culture and woking at Patanjali office, haridwar?",0,32.714481353759766,0.19806456565856934,16.661823,binary,is_duplicate
What is the different between Chinese wedding ceremony and western wedding ceremony?,What is the difference between Chinese and Western style wedding?,1,186.71792602539062,0.886502206325531,6.938691,binary,is_duplicate
What is the condition of tourism in Pakistan?,Preferable PG courses for BE (EEE) student in Tamil Nadu?,0,32.392791748046875,0.1566406786441803,18.791283,binary,is_duplicate
What is the different between offshore and onshore funds?,What is the difference between offshore and onshore?,0,172.8201904296875,0.7673246264457703,10.37912,binary,is_duplicate
Why should one hate Shahrukh Khan?,Why do people hate Shahrukh Khan and why do people feel that he is not an Indian?,1,166.24656677246094,0.7939152717590332,9.633399,binary,is_duplicate
What are the best self-help books you've ever read?,What are the top self help books I should read?,1,173.7091827392578,0.8704854846000671,7.265898,binary,is_duplicate
Is Evernote useful?,What is Evernote used for?,1,200.74668884277344,0.8719576597213745,7.686398,binary,is_duplicate
A title for my continuation to The Gift of the Magi?,How do I start my continuation for the Gift of the Magi?,0,148.4437713623047,0.8222686052322388,8.0414,binary,is_duplicate
What is a good song to lyric prank your best friend?,What are some good lyric prank songs to send your best friends?,1,199.22994995117188,0.8192245364189148,9.396559,binary,is_duplicate
I argued with my gf that she made friends with the person that hit on her. She said I'm a control freak and she wants her freedom. What should I do?,I'm a girl in middle school. My best friends are all girls. I've found out that I'm bisexual. How do I tell my best friend who's a girl without her freaking out and it changing our whole friendship?,0,45.89836502075195,0.3452511727809906,13.194321,binary,is_duplicate
How do I pass a drug test for methamphetamine?,Can hair dye help pass a hair follicle drug test for daily meth smokers?,1,164.5550537109375,0.8177765607833862,8.703763,binary,is_duplicate
How could start with open source development?,How should I start contributing to open source projects?,1,172.1257781982422,0.7562481760978699,10.538534,binary,is_duplicate
Why do dreams look so real?,"If you dream about some kind of harm, will there be injuries in real life?",0,100.40035247802734,0.5126041173934937,13.968166,binary,is_duplicate
Do cricket players really drink tea on a tea break?,Do cricketers actually drink tea during tea break?,1,210.8909912109375,0.9264578223228455,5.8865886,binary,is_duplicate
How can I get entry in MIT?,What are the requirements for selection into MIT?,1,206.95651245117188,0.8719120025634766,7.8079424,binary,is_duplicate
Does a fetus breathe when it's inside a womb?,How does a fetus exhale in the womb?,1,200.45350646972656,0.7792174220085144,11.001667,binary,is_duplicate
What are movies with incest scenes?,Are there any good incest movie?,1,212.6862335205078,0.8530390858650208,8.608313,binary,is_duplicate
"What are the signs that a guy has feelings for you or has a crush on you, but doesn't want to show it, so he hides it?",The guy I'm dating never texts me and I feel like he doesn't care about me but when I see him he shows me he likes me and wants me. Why do I feel this way?,0,64.79706573486328,0.4534990191459656,12.599445,binary,is_duplicate
