first_sentence,second_sentence,score,dot_score,cos_score,eucl_score,score_type,score_name
This book introduced Shakespeare to Ovid; it was a major influence on his writing.,It was a major influence on Shakespeare's writing.,1,126.37242126464844,0.7432774305343628,9.343289,binary,is_entailment
Thomson visited Cooper's grave in 1765. At that date he had been dead for five years.,Cooper had been dead for five years.,1,111.3050537109375,0.6739999651908875,10.559836,binary,is_entailment
"Fred was supposed to run the dishwasher, but he put it off, because he wanted to watch TV. But the show turned out to be boring, so he changed his mind and turned it on.",He changed his mind and turned the TV on.,0,101.88150024414062,0.5878404974937439,12.462828,binary,is_entailment
"Paul tried to call George on the phone, but he wasn't available.",George wasn't available.,1,99.3421859741211,0.5187744498252869,13.819878,binary,is_entailment
"When Tatyana reached the cabin, her mother was sleeping. She was careful not to disturb her, undressing and climbing back into her berth.","Tatyana was careful not to disturb her, undressing and climbing back into her berth.",1,112.75799560546875,0.7506231665611267,8.768704,binary,is_entailment
"Bernard, who had not told the government official that he was less than 21 when he filed for a homestead claim, did not consider that he had done anything dishonest. Still, anyone who knew that he was 19 years old could take his claim away from him.",Anyone who knew that he was 19 years old could take his claim away from the government official.,0,66.33811950683594,0.5389640927314758,10.6533,binary,is_entailment
Fred is the only man still alive who remembers my great-grandfather. He is a remarkable man.,My great-grandfather is a remarkable man.,0,95.94578552246094,0.5465836524963379,12.938334,binary,is_entailment
I put the cake away in the refrigerator. It has a lot of leftovers in it.,The cake has a lot of leftovers in it.,0,132.71351623535156,0.7129374146461487,10.436247,binary,is_entailment
Jim signaled the barman and gestured toward his bathroom key.,Jim signaled the barman and gestured toward The barman's bathroom key.,1,182.3048095703125,0.9692869186401367,3.4794056,binary,is_entailment
Steve follows Fred's example in everything. He influences him hugely.,Fred influences him hugely.,1,153.99659729003906,0.7382028698921204,10.4512005,binary,is_entailment
"When Tatyana reached the cabin, her mother was sleeping. She was careful not to disturb her , undressing and climbing back into her berth.","She was careful not to disturb her mother , undressing and climbing back into her berth.",1,97.97159576416016,0.6758928298950195,9.754135,binary,is_entailment
Jane gave Joan candy because she wasn't hungry.,Jane wasn't hungry.,1,198.9945831298828,0.6466959118843079,14.745847,binary,is_entailment
"When Tommy dropped his ice cream, Timmy giggled, so father gave him a stern look.",Father gave Tommy a stern look.,0,136.38450622558594,0.6782431602478027,11.736747,binary,is_entailment
"I couldn't find a spoon, so I tried using a pen to stir my coffee. But that turned out to be a bad idea, because it got full of ink.",The coffee got full of ink.,1,103.1706314086914,0.5903593301773071,13.427761,binary,is_entailment
The man couldn't lift his son because he was so weak.,The son was so weak.,0,151.27894592285156,0.8157691359519958,8.2755785,binary,is_entailment
"Sam tried to paint a picture of shepherds with sheep, but they ended up looking more like golfers.",The shepherds ended up looking more like golfers.,1,99.32510375976562,0.641452968120575,10.687169,binary,is_entailment
"I couldn't find a spoon, so I tried using a pen to stir my coffee. But that turned out to be a bad idea, because it got full of ink.",The pen got full of ink.,0,83.5289077758789,0.5062637329101562,13.769462,binary,is_entailment
John was jogging through the park when he saw a man juggling watermelons. He was very impressed.,John was very impressed.,1,78.1753921508789,0.41020292043685913,15.636118,binary,is_entailment
"Fred covered his eyes with his hands, because the wind was blowing sand around. He lowered them when the wind stopped.",He lowered his eyes when the wind stopped.,0,109.92243194580078,0.6157758235931396,11.990694,binary,is_entailment
The delivery truck zoomed by the school bus because it was going so fast.,The school bus was going so fast.,0,240.0215301513672,0.8180304765701294,10.353545,binary,is_entailment
"During a game of tag, Ethan chased Luke because he was ""it"".","Luke was ""it"".",0,112.40959930419922,0.5859918594360352,12.64211,binary,is_entailment
There is a gap in the wall. You can see the garden behind it.,You can see the garden through the wall.,1,138.50340270996094,0.839702308177948,7.2728567,binary,is_entailment
I took the water bottle out of the backpack so that it would be lighter.,I took the water bottle out of the backpack so that the water bottle would be lighter.,0,144.8870391845703,0.9775239825248718,2.5828917,binary,is_entailment
"The sun was covered by a thick cloud all morning, but luckily, by the time the picnic started, it was out.",The sun was out.,1,124.05712127685547,0.6356543898582458,12.08168,binary,is_entailment
Jim yelled at Kevin because he was so upset.,Jim was so upset.,1,205.95480346679688,0.7579105496406555,11.603943,binary,is_entailment
"Even before they reached town, they could hear a sound like corn popping. Dora asked what it was, and Dad said it was firecrackers.",Dora asked what the sound was.,1,70.62525939941406,0.5151479244232178,11.562759,binary,is_entailment
Bill passed the gameboy to John because his turn was next.,Bill's turn was next.,0,120.00119018554688,0.7142658829689026,9.8488035,binary,is_entailment
"Fred was supposed to run the dishwasher, but he put it off, because he wanted to watch TV. But the show turned out to be boring, so he changed his mind and turned it on.",He changed his mind and turned the dishwasher on.,1,104.66539001464844,0.6106164455413818,12.033406,binary,is_entailment
"As Ollie carried Tommy up the long winding steps, his legs ached.",Tommy's legs ached.,0,137.45704650878906,0.7190582156181335,10.493659,binary,is_entailment
The foxes are getting in at night and attacking the chickens. I shall have to kill them.,I shall have to kill The chickens.,0,131.62136840820312,0.7282196879386902,10.0071125,binary,is_entailment
"Papa looked down at the children's faces, so puzzled and sad now. It was bad enough that they had to be denied so many things because he couldn't afford them.",It was bad enough that the faces had to be denied so many things because he couldn't afford them.,0,69.24027252197266,0.63520747423172,8.943093,binary,is_entailment
"The sack of potatoes had been placed above the bag of flour, so it had to be moved first.",The bag of flour had to be moved first.,0,124.89788818359375,0.861240804195404,6.3496847,binary,is_entailment
"The dog chased the cat, which ran up a tree. It waited at the top.",The dog waited at the top.,0,46.21065139770508,0.22607143223285675,17.789574,binary,is_entailment
Steve follows Fred's example in everything. He admires him hugely.,Fred admires him hugely.,0,168.60650634765625,0.7150924801826477,11.626656,binary,is_entailment
The woman held the girl against her chest.,The woman held the girl against the woman's chest.,1,226.9205322265625,0.9135816097259521,6.5633664,binary,is_entailment
"The dog chased the cat, which ran up a tree. It waited at the bottom.",The dog waited at the bottom.,1,70.18230438232422,0.33271536231040955,16.779472,binary,is_entailment
Bob collapsed on the sidewalk. Soon he saw Carl coming to help. He was very concerned.,Carl was very concerned.,1,112.02666473388672,0.655162513256073,10.986267,binary,is_entailment
Sam broke both his ankles and he's walking with crutches. But a month or so from now they should be unnecessary.,The crutches should be unnecessary.,1,100.9537353515625,0.6131953001022339,11.879209,binary,is_entailment
"I stuck a pin through a carrot. When I pulled the pin out, it left a hole.",The carrot left a hole.,0,110.45105743408203,0.6424078345298767,11.429578,binary,is_entailment
"Sam tried to paint a picture of shepherds with sheep, but they ended up looking more like dogs.",The sheep ended up looking more like dogs.,1,126.93315887451172,0.6975811719894409,10.559898,binary,is_entailment
"In the middle of the outdoor concert, the rain started falling, and it continued until 10.",The concert continued until 10.,0,122.42069244384766,0.5049878358840942,15.591456,binary,is_entailment
The firemen arrived before the police because they were coming from so far away.,The firemen were coming from so far away.,0,155.1077423095703,0.7461174130439758,10.277734,binary,is_entailment
"I was trying to open the lock with the key, but someone had filled the keyhole with chewing gum, and I couldn't get it in.",I couldn't get the key in.,1,112.77889251708984,0.6689008474349976,10.599445,binary,is_entailment
Of one thing Mark was sure. Harry knew much less than he did.,Harry knew much less than Mark did.,1,148.81829833984375,0.8826673030853271,6.3023663,binary,is_entailment
The Dakota prairie lay so warm and bright under the shining sun that it did not seem possible that it had ever been swept by the winds and snows of that hard winter.,It did not seem possible that the prairie had ever been swept by the winds and snows of that hard winter.,1,140.11351013183594,0.7805405855178833,9.014788,binary,is_entailment
"It was a summer afternoon, and the dog was sitting in the middle of the lawn. After a while, it got up and moved to a spot under the tree, because it was hot.",The dog was hot.,1,98.67469024658203,0.502314031124115,14.515162,binary,is_entailment
Frank felt vindicated when his longtime rival Bill revealed that he was the winner of the competition.,Frank was the winner of the competition.,1,184.50140380859375,0.765716552734375,10.633186,binary,is_entailment
Joan made sure to thank Susan for all the help she had given.,Joan made sure to thank Susan for all the help Susan had given.,1,241.37864685058594,0.9857639074325562,2.6714585,binary,is_entailment
"They broadcast an announcement, but a subway came into the station and I couldn't hear over it.",I couldn't hear the announcement.,0,108.41685485839844,0.5918601751327515,12.432194,binary,is_entailment
John was doing research in the library when he heard a man humming and whistling. He was very annoyed.,John was very annoyed.,1,83.1168441772461,0.5100463628768921,12.993405,binary,is_entailment
Mary took out her flute and played one of her favorite pieces. She has loved it since she was a child.,She has loved the piece since she was a child.,1,101.33129119873047,0.5774562358856201,12.509339,binary,is_entailment
I'm sure that my map will show this building; it is very good.,The map is very good.,1,132.716796875,0.6598684787750244,12.036714,binary,is_entailment
Carol believed that Rebecca regretted that she had stolen the watch.,Carol believed that Rebecca regretted that Rebecca had stolen the watch.,1,158.6466827392578,0.9901826977729797,1.8034664,binary,is_entailment
The table won't fit through the doorway because it is too narrow.,The doorway is too narrow.,1,115.93547058105469,0.6444100737571716,11.394829,binary,is_entailment
"If the con artist has succeeded in fooling Sam, he would have lost a lot of money.",The con artist would have lost a lot of money.,0,91.41461181640625,0.8108577728271484,6.6608257,binary,is_entailment
"Sam pulled up a chair to the piano, but it was broken, so he had to sing instead.","The piano was broken, so he had to sing instead.",1,126.37706756591797,0.7915608882904053,8.391753,binary,is_entailment
"Fred is the only man alive who still remembers my father as an infant. When Fred first saw my father, he was twelve months old.","When Fred first saw my father, Fred was twelve months old.",0,94.46255493164062,0.6600592136383057,9.914293,binary,is_entailment
Anna did a lot better than her good friend Lucy on the test because she had studied so hard.,Lucy had studied so hard.,0,131.9464874267578,0.6374813318252563,12.574791,binary,is_entailment
"Jane knocked on the door, and Susan answered it. She invited her to come out.",Susan invited her to come out.,0,136.09576416015625,0.7467071413993835,9.624536,binary,is_entailment
"The path to the lake was blocked, so we couldn't reach it.",We couldn't reach the lake.,1,159.4248504638672,0.7776332497596741,9.649425,binary,is_entailment
Grace was happy to trade me her sweater for my jacket. She thinks it looks dowdy on her.,The jacket looks dowdy on her.,0,121.5919418334961,0.6703333258628845,11.433215,binary,is_entailment
Kirilov ceded the presidency to Shatov because he was more popular.,Kirilov was more popular.,0,134.25778198242188,0.7505565285682678,9.453017,binary,is_entailment
"I tried to paint a picture of an orchard, with lemons in the lemon trees, but they came out looking more like telephone poles.",The lemon trees came out looking more like telephone poles.,1,118.18220520019531,0.7832147479057312,8.212759,binary,is_entailment
Pete envies Martin because he is very successful.,Martin is very successful.,1,183.00180053710938,0.7304989099502563,11.793684,binary,is_entailment
"Since it was raining, I carried the newspaper in my backpack to keep it dry.",I carried the newspaper in my backpack to keep the newspaper dry.,1,150.86927795410156,0.8265953063964844,8.060329,binary,is_entailment
"Pam's parents came home and found her having sex with her boyfriend, Paul. They were furious about it.",Pam and Paul were furious about it.,0,117.52959442138672,0.670900821685791,10.762267,binary,is_entailment
"I sat there feeling rather like a chappie I'd once read about in a book, who murdered another cove and hid the body under the dining-room table, and then had to be the life and soul of a dinner party, with it there all the time.","He had to be the life and soul of a dinner party, with the dinner party there all the time.",0,60.427371978759766,0.5534689426422119,10.325648,binary,is_entailment
"In the storm, the tree fell down and crashed through the roof of my house. Now, I have to get it removed.",Now I have to get The tree removed.,1,112.16621398925781,0.6693602800369263,10.545867,binary,is_entailment
"Fred was supposed to run the dishwasher, but he put it off, because he wanted to watch TV. But the show turned out to be boring, so he changed his mind and turned it off.",He changed his mind and turned the TV off.,1,103.18408203125,0.5664011240005493,13.208363,binary,is_entailment
"In the middle of the outdoor concert, the rain started falling, and it continued until 10.",The rain continued until 10.,1,130.63372802734375,0.5544726848602295,14.5467,binary,is_entailment
"It is not easy to space buttonholes exactly the same distance apart, and it is very difficult to cut them precisely the right size. The tiniest slip of the scissors will make the hole too large, and even one thread uncut will leave it too small.",Even one thread uncut will leave one thread too small.,0,68.22330474853516,0.4802151620388031,12.887722,binary,is_entailment
"Sam took French classes from Adam, because he was known to speak it fluently.",Adam was known to speak it fluently.,1,170.7616424560547,0.7109911441802979,11.9445505,binary,is_entailment
Sid explained his theory to Mark but he couldn't convince him.,Sid couldn't convince him.,1,108.08563232421875,0.7556886076927185,8.388765,binary,is_entailment
"Everyone really loved the oatmeal cookies; only a few people liked the chocolate chip cookies. Next time, we should make more of them.",We should make more of the oatmeal cookies.,1,115.61396789550781,0.7792965769767761,8.12606,binary,is_entailment
"The sack of potatoes had been placed below the bag of flour, so it had to be moved first.",The bag of flour had to be moved first.,1,126.49503326416016,0.8768123388290405,5.9710627,binary,is_entailment
"As Ollie carried Tommy up the long winding steps, his legs dangled.",Tommy's legs dangled.,1,127.67058563232422,0.6095908880233765,13.107605,binary,is_entailment
Sam Goodman's biography of the Spartan general Xenophanes conveys a vivid sense of the difficulties he faced in his research.,Sam Goodman's biography of the Spartan general Xenophanes conveys a vivid sense of the difficulties Goodman faced in his research.,1,120.64100646972656,0.9744690656661987,2.5150843,binary,is_entailment
"Mark became absorbed in Blaze, the white horse. He was afraid the stable boys at the Burlington Stables struck at him and bullied him because he was timid, so he took upon himself the feeding and care of the animal.",Blaze took upon himself the feeding and care of the animal.,0,94.74911499023438,0.5887922048568726,11.680362,binary,is_entailment
"Joe's uncle can still beat him at tennis, even though he is 30 years older.",Joe's uncle is 30 years older.,1,94.8801040649414,0.6059628129005432,11.10832,binary,is_entailment
"Alice was dusting the living room and trying to find the button that Mama had hidden. No time today to look at old pictures in her favorite photo album. Today she had to hunt for a button, so she put the album on a chair without even opening it.",Mama had to hunt for a button.,0,87.99813079833984,0.6094913482666016,10.98741,binary,is_entailment
I poured water from the bottle into the cup until it was full.,The cup was full.,1,156.67300415039062,0.5407103300094604,17.52229,binary,is_entailment
"During a game of tag, Ethan chased Luke because he was ""it"".","Ethan was ""it"".",1,127.15186309814453,0.6346622705459595,12.208457,binary,is_entailment
Jane gave Joan candy because she was hungry.,Joan was hungry.,1,182.50048828125,0.7444018721580505,11.196271,binary,is_entailment
"Mr. Moncrieff visited Chester's luxurious New York apartment, thinking that it belonged to his son Edward. The result was that Mr. Moncrieff has decided to cancel Edward's allowance on the ground that he no longer requires his financial support.",Edward no longer requires his financial support.,1,48.92873001098633,0.361338347196579,13.663574,binary,is_entailment
"When Tommy dropped his ice cream, Timmy giggled, so father gave him a sympathetic look.",Father gave Tommy a sympathetic look.,1,134.1280517578125,0.6938408613204956,11.114618,binary,is_entailment
John was doing research in the library when he heard a man humming and whistling. He was very annoyed.,The man was very annoyed.,0,79.87739562988281,0.5168715715408325,12.431048,binary,is_entailment
"It is not easy to space buttonholes exactly the same distance apart, and it is very difficult to cut them precisely the right size. The tiniest slip of the scissors will make the hole too large, and even one thread uncut will leave it too small.",Even one thread uncut will leave the slip too small.,0,59.90939712524414,0.4497472643852234,12.576164,binary,is_entailment
Susan knows all about Ann's personal problems because she is nosy.,Ann is nosy.,0,146.92247009277344,0.5819130539894104,14.541829,binary,is_entailment
"It is not easy to space buttonholes exactly the same distance apart, and it is very difficult to cut them precisely the right size. The tiniest slip of the scissors will make the hole too large, and even one thread uncut will leave it too small.",Even one thread uncut will leave the scissors too small.,0,73.90818786621094,0.547484278678894,11.618697,binary,is_entailment
"The sun was covered by a thick cloud all morning, but luckily, by the time the picnic started, it was out.",The cloud was out.,0,104.55762481689453,0.5189688801765442,14.131162,binary,is_entailment
"The journalists interviewed the stars of the new movie. They were very cooperative, so the interview lasted for a long time.","The stars were very cooperative, so the interview lasted for a long time.",1,98.82789611816406,0.6120769381523132,11.202804,binary,is_entailment
The city councilmen refused the demonstrators a permit because they feared violence.,The city councilmen feared violence.,1,143.3652801513672,0.6742413640022278,11.829301,binary,is_entailment
Anne gave birth to a daughter last month. She is a very charming woman.,Anne's daughter is a very charming woman.,0,138.4935760498047,0.7455722689628601,10.393983,binary,is_entailment
"Jackson was greatly influenced by Arnold, though he lived two centuries later.",Jackson lived two centuries later.,1,119.35572052001953,0.734194815158844,9.358123,binary,is_entailment
This book introduced Shakespeare to Ovid; it was a fine selection of his writing.,It was a fine selection of Shakespeare's writing.,0,177.27871704101562,0.7770329117774963,10.1231365,binary,is_entailment
The father carried the sleeping boy in his bassinet.,The father carried the sleeping boy in the father's bassinet.,0,203.38795471191406,0.9579197764396667,4.2616134,binary,is_entailment
"Dan took the rear seat while Bill claimed the front because his ""Dibs!"" was quicker.","Dan took the rear seat while Bill claimed the front because Dan's ""Dibs!"" was quicker.",0,142.05496215820312,0.9907797574996948,1.6276613,binary,is_entailment
Pete envies Martin although he is very successful.,Martin is very successful.,0,167.58750915527344,0.691131591796875,12.489974,binary,is_entailment
Of one thing Mark was sure. Harry knew much less than he did.,Harry knew much less than Harry did.,0,151.6964111328125,0.8368686437606812,7.813856,binary,is_entailment
"Since Chester was dependent on Uncle Vernon, he couldn't very well marry without his approval",Uncle Vernon couldn't very well marry without his approval,0,141.34698486328125,0.8677038550376892,6.685035,binary,is_entailment
Thomson visited Cooper's grave in 1765. At that date he had been dead for five years.,Thomson had been dead for five years.,0,95.95989227294922,0.6177660226821899,10.956148,binary,is_entailment
"Mark told Pete many lies about himself, which Pete included in his book. He should have been more skeptical.",Mark should have been more skeptical.,0,102.11150360107422,0.6343303918838501,10.859154,binary,is_entailment
"My meeting started at 4:00 and I needed to catch the train at 4:30, so there wasn't much time. Luckily, it was delayed, so it worked out.","The meeting was delayed, so it worked out.",0,98.63548278808594,0.6202223300933838,11.107761,binary,is_entailment
The foxes are getting in at night and attacking the chickens. They have gotten very nervous.,The foxes have gotten very nervous.,0,155.95126342773438,0.7907843589782715,9.115507,binary,is_entailment
I put the butterfly wing on the table and it broke.,The butterfly wing broke.,1,120.26192474365234,0.6648632884025574,11.142469,binary,is_entailment
"Fred and Alice had very warm down coats, but they were not prepared for the cold in Alaska.",Fred and Alice were not prepared for the cold in Alaska.,1,172.02622985839844,0.8345481753349304,8.262244,binary,is_entailment
Tom gave Ralph a lift to school so he wouldn't have to walk.,Tom wouldn't have to walk.,0,109.05291748046875,0.5407661199569702,13.677313,binary,is_entailment
I put the cake away in the refrigerator. It has a lot of leftovers in it.,The refrigerator has a lot of leftovers in it.,1,113.33855438232422,0.6003462076187134,12.392159,binary,is_entailment
Sid explained his theory to Mark but he couldn't convince him.,Mark couldn't convince him.,0,98.77836608886719,0.6396321654319763,10.682507,binary,is_entailment
I took the water bottle out of the backpack so that it would be handy.,I took the water bottle out of the backpack so that the water bottle would be handy.,1,141.43186950683594,0.9793983101844788,2.4428396,binary,is_entailment
The fish ate the worm. It was tasty.,The worm was tasty.,1,201.84945678710938,0.8147079944610596,9.582087,binary,is_entailment
"As Andrea in the crop duster passed over Susan, she could see the landing strip.",Andrea could see the landing strip.,1,129.9169464111328,0.7452821135520935,9.508562,binary,is_entailment
"As Andrea in the crop duster passed over Susan, she could see the landing strip.",Susan could see the landing strip.,0,120.83216094970703,0.7093478441238403,9.996379,binary,is_entailment
"Lionel is holding captive a scientist, Dr. Vardi, who has invented a device that turns animals invisible; Lionel plans to use it on Geoffrey and send him to steal nuclear material from an army vault.",Lionel plans to use it on Geoffrey and send Geoffrey to steal nuclear material from an army vault.,1,89.40924072265625,0.5817790627479553,11.398994,binary,is_entailment
Kirilov ceded the presidency to Shatov because he was more popular.,Shatov was more popular.,1,144.95596313476562,0.7872331142425537,8.85194,binary,is_entailment
"Bernard, who had not told the government official that he was less than 21 when he filed for a homestead claim, did not consider that he had done anything dishonest. Still, anyone who knew that he was 19 years old could take his claim away from him.",The government official was less than 21 when he filed for a homestead claim.,0,76.01315307617188,0.5477478504180908,11.293282,binary,is_entailment
Mama came over and sat down beside Alice. Gently she stroked her hair and let the child weep.,Alice stroked her hair and let the child weep.,0,144.24227905273438,0.8269725441932678,8.142163,binary,is_entailment
"Alice looked for her friend Jade in the crowd. Since she always has good luck, Alice spotted her quickly.","Since Jade always has good luck, Alice spotted her quickly.",0,137.5260009765625,0.8242987990379333,8.000329,binary,is_entailment
"I sat there feeling rather like a chappie I'd once read about in a book, who murdered another cove and hid the body under the dining-room table, and then had to be the life and soul of a dinner party, with it there all the time.","He had to be the life and soul of a dinner party, with the body there all the time.",1,60.429298400878906,0.5747733116149902,9.799468,binary,is_entailment
